experiments/latency/tvm_schedule_configs/inception_v3_None_1.log
{"i": ["cuda", "topi_nn_conv2d", [["TENSOR", [1, 2048, 8, 8], "float32"], ["TENSOR", [192, 2048, 1, 1], "float32"], [1, 1], [0, 0], [1, 1], "NCHW", "float32"], {}, ["conv2d", [1, 2048, 8, 8, "float32"], [192, 2048, 1, 1, "float32"], [1, 1], [0, 0], [1, 1], "NCHW", "float32"], {"i": 720442, "t": "direct", "c": null, "e": [["tile_f", "sp", [-1, 2, 12, 1]], ["tile_y", "sp", [-1, 1, 2, 1]], ["tile_x", "sp", [-1, 1, 4, 1]], ["tile_rc", "sp", [-1, 32]], ["tile_ry", "sp", [-1, 1]], ["tile_rx", "sp", [-1, 1]], ["auto_unroll_max_step", "ot", 0], ["unroll_explicit", "ot", 0]]}], "r": [[4.9721550000000005e-05], 0, 48.281333208084106, 1601330561.818603], "v": 0.1}
{"i": ["cuda", "topi_nn_conv2d", [["TENSOR", [1, 2048, 8, 8], "float32"], ["TENSOR", [448, 2048, 1, 1], "float32"], [1, 1], [0, 0], [1, 1], "NCHW", "float32"], {}, ["conv2d", [1, 2048, 8, 8, "float32"], [448, 2048, 1, 1, "float32"], [1, 1], [0, 0], [1, 1], "NCHW", "float32"], {"i": 5573352, "t": "direct", "c": null, "e": [["tile_f", "sp", [-1, 1, 8, 2]], ["tile_y", "sp", [-1, 1, 4, 1]], ["tile_x", "sp", [-1, 1, 8, 1]], ["tile_rc", "sp", [-1, 32]], ["tile_ry", "sp", [-1, 1]], ["tile_rx", "sp", [-1, 1]], ["auto_unroll_max_step", "ot", 0], ["unroll_explicit", "ot", 1]]}], "r": [[5.1589249999999994e-05], 0, 91.1284110546112, 1601333741.8042457], "v": 0.1}
{"i": ["cuda", "topi_nn_conv2d", [["TENSOR", [1, 2048, 8, 8], "float32"], ["TENSOR", [384, 2048, 1, 1], "float32"], [1, 1], [0, 0], [1, 1], "NCHW", "float32"], {}, ["conv2d", [1, 2048, 8, 8, "float32"], [384, 2048, 1, 1, "float32"], [1, 1], [0, 0], [1, 1], "NCHW", "float32"], {"i": 8152485, "t": "direct", "c": null, "e": [["tile_f", "sp", [-1, 1, 12, 2]], ["tile_y", "sp", [-1, 1, 2, 1]], ["tile_x", "sp", [-1, 1, 8, 1]], ["tile_rc", "sp", [-1, 64]], ["tile_ry", "sp", [-1, 1]], ["tile_rx", "sp", [-1, 1]], ["auto_unroll_max_step", "ot", 0], ["unroll_explicit", "ot", 1]]}], "r": [[4.61909e-05], 0, 90.65334033966064, 1601336967.3622599], "v": 0.1}
{"i": ["cuda", "topi_nn_conv2d", [["TENSOR", [1, 1280, 8, 8], "float32"], ["TENSOR", [192, 1280, 1, 1], "float32"], [1, 1], [0, 0], [1, 1], "NCHW", "float32"], {}, ["conv2d", [1, 1280, 8, 8, "float32"], [192, 1280, 1, 1, "float32"], [1, 1], [0, 0], [1, 1], "NCHW", "float32"], {"i": 13623849, "t": "direct", "c": null, "e": [["tile_f", "sp", [-1, 1, 12, 1]], ["tile_y", "sp", [-1, 1, 4, 1]], ["tile_x", "sp", [-1, 1, 4, 1]], ["tile_rc", "sp", [-1, 80]], ["tile_ry", "sp", [-1, 1]], ["tile_rx", "sp", [-1, 1]], ["auto_unroll_max_step", "ot", 1500], ["unroll_explicit", "ot", 1]]}], "r": [[2.1914800000000002e-05], 0, 92.85932493209839, 1601339606.1877446], "v": 0.1}
{"i": ["cuda", "topi_nn_conv2d", [["TENSOR", [1, 1280, 8, 8], "float32"], ["TENSOR", [448, 1280, 1, 1], "float32"], [1, 1], [0, 0], [1, 1], "NCHW", "float32"], {}, ["conv2d", [1, 1280, 8, 8, "float32"], [448, 1280, 1, 1, "float32"], [1, 1], [0, 0], [1, 1], "NCHW", "float32"], {"i": 6098115, "t": "direct", "c": null, "e": [["tile_f", "sp", [-1, 1, 14, 1]], ["tile_y", "sp", [-1, 1, 8, 1]], ["tile_x", "sp", [-1, 1, 4, 1]], ["tile_rc", "sp", [-1, 40]], ["tile_ry", "sp", [-1, 1]], ["tile_rx", "sp", [-1, 1]], ["auto_unroll_max_step", "ot", 1500], ["unroll_explicit", "ot", 0]]}], "r": [[3.0593200000000004e-05], 0, 91.74386525154114, 1601342707.7101738], "v": 0.1}
{"i": ["cuda", "topi_nn_conv2d", [["TENSOR", [1, 448, 8, 8], "float32"], ["TENSOR", [384, 448, 3, 3], "float32"], [1, 1], [1, 1], [1, 1], "NCHW", "float32"], {}, ["conv2d", [1, 448, 8, 8, "float32"], [384, 448, 3, 3, "float32"], [1, 1], [1, 1], [1, 1], "NCHW", "float32"], {"i": 30349977, "t": "direct", "c": null, "e": [["tile_f", "sp", [-1, 1, 8, 1]], ["tile_y", "sp", [-1, 1, 8, 1]], ["tile_x", "sp", [-1, 2, 1, 1]], ["tile_rc", "sp", [-1, 8]], ["tile_ry", "sp", [-1, 3]], ["tile_rx", "sp", [-1, 3]], ["auto_unroll_max_step", "ot", 1500], ["unroll_explicit", "ot", 0]]}], "r": [[6.22905e-05], 0, 66.28433108329773, 1601346893.3911061], "v": 0.1}
{"i": ["cuda", "topi_nn_conv2d", [["TENSOR", [1, 384, 8, 8], "float32"], ["TENSOR", [384, 384, 3, 1], "float32"], [1, 1], [1, 0], [1, 1], "NCHW", "float32"], {}, ["conv2d", [1, 384, 8, 8, "float32"], [384, 384, 3, 1, "float32"], [1, 1], [1, 0], [1, 1], "NCHW", "float32"], {"i": 16790953, "t": "direct", "c": null, "e": [["tile_f", "sp", [-1, 1, 16, 1]], ["tile_y", "sp", [-1, 2, 1, 1]], ["tile_x", "sp", [-1, 1, 8, 1]], ["tile_rc", "sp", [-1, 16]], ["tile_ry", "sp", [-1, 3]], ["tile_rx", "sp", [-1, 1]], ["auto_unroll_max_step", "ot", 1500], ["unroll_explicit", "ot", 0]]}], "r": [[2.5747949999999998e-05], 0, 85.97610139846802, 1601349709.4595728], "v": 0.1}
{"i": ["cuda", "topi_nn_conv2d", [["TENSOR", [1, 1280, 8, 8], "float32"], ["TENSOR", [384, 1280, 1, 1], "float32"], [1, 1], [0, 0], [1, 1], "NCHW", "float32"], {}, ["conv2d", [1, 1280, 8, 8, "float32"], [384, 1280, 1, 1, "float32"], [1, 1], [0, 0], [1, 1], "NCHW", "float32"], {"i": 15448387, "t": "direct", "c": null, "e": [["tile_f", "sp", [-1, 1, 12, 1]], ["tile_y", "sp", [-1, 1, 2, 1]], ["tile_x", "sp", [-1, 1, 8, 1]], ["tile_rc", "sp", [-1, 32]], ["tile_ry", "sp", [-1, 1]], ["tile_rx", "sp", [-1, 1]], ["auto_unroll_max_step", "ot", 512], ["unroll_explicit", "ot", 1]]}], "r": [[2.92097e-05], 0, 97.06789946556091, 1601352816.3929408], "v": 0.1}
{"i": ["cuda", "topi_nn_conv2d", [["TENSOR", [1, 384, 8, 8], "float32"], ["TENSOR", [384, 384, 1, 3], "float32"], [1, 1], [0, 1], [1, 1], "NCHW", "float32"], {}, ["conv2d", [1, 384, 8, 8, "float32"], [384, 384, 1, 3, "float32"], [1, 1], [0, 1], [1, 1], "NCHW", "float32"], {"i": 23494725, "t": "direct", "c": null, "e": [["tile_f", "sp", [-1, 1, 12, 2]], ["tile_y", "sp", [-1, 1, 4, 1]], ["tile_x", "sp", [-1, 1, 4, 1]], ["tile_rc", "sp", [-1, 48]], ["tile_ry", "sp", [-1, 1]], ["tile_rx", "sp", [-1, 3]], ["auto_unroll_max_step", "ot", 0], ["unroll_explicit", "ot", 1]]}], "r": [[2.32028e-05], 0, 54.36189103126526, 1601356294.039125], "v": 0.1}
{"i": ["cuda", "topi_nn_conv2d", [["TENSOR", [1, 192, 17, 17], "float32"], ["TENSOR", [192, 192, 3, 3], "float32"], [2, 2], [0, 0], [1, 1], "NCHW", "float32"], {}, ["conv2d", [1, 192, 17, 17, "float32"], [192, 192, 3, 3, "float32"], [2, 2], [0, 0], [1, 1], "NCHW", "float32"], {"i": 36620697, "t": "direct", "c": null, "e": [["tile_f", "sp", [-1, 1, 12, 1]], ["tile_y", "sp", [-1, 1, 1, 2]], ["tile_x", "sp", [-1, 1, 8, 1]], ["tile_rc", "sp", [-1, 12]], ["tile_ry", "sp", [-1, 3]], ["tile_rx", "sp", [-1, 3]], ["auto_unroll_max_step", "ot", 512], ["unroll_explicit", "ot", 1]]}], "r": [[2.7102050000000003e-05], 0, 94.97553730010986, 1601359713.3716192], "v": 0.1}
{"i": ["cuda", "topi_nn_conv2d", [["TENSOR", [1, 192, 17, 17], "float32"], ["TENSOR", [192, 192, 1, 7], "float32"], [1, 1], [0, 3], [1, 1], "NCHW", "float32"], {}, ["conv2d", [1, 192, 17, 17, "float32"], [192, 192, 1, 7, "float32"], [1, 1], [0, 3], [1, 1], "NCHW", "float32"], {"i": 696243, "t": "direct", "c": null, "e": [["tile_f", "sp", [-1, 3, 8, 1]], ["tile_y", "sp", [-1, 1, 1, 1]], ["tile_x", "sp", [-1, 1, 17, 1]], ["tile_rc", "sp", [-1, 4]], ["tile_ry", "sp", [-1, 1]], ["tile_rx", "sp", [-1, 7]], ["auto_unroll_max_step", "ot", 512], ["unroll_explicit", "ot", 1]]}], "r": [[5.67364e-05], 0, 97.11952495574951, 1601361590.798157], "v": 0.1}
{"i": ["cuda", "topi_nn_conv2d", [["TENSOR", [1, 192, 17, 17], "float32"], ["TENSOR", [192, 192, 7, 1], "float32"], [1, 1], [3, 0], [1, 1], "NCHW", "float32"], {}, ["conv2d", [1, 192, 17, 17, "float32"], [192, 192, 7, 1, "float32"], [1, 1], [3, 0], [1, 1], "NCHW", "float32"], {"i": 707179, "t": "direct", "c": null, "e": [["tile_f", "sp", [-1, 1, 8, 6]], ["tile_y", "sp", [-1, 1, 1, 1]], ["tile_x", "sp", [-1, 1, 17, 1]], ["tile_rc", "sp", [-1, 8]], ["tile_ry", "sp", [-1, 7]], ["tile_rx", "sp", [-1, 1]], ["auto_unroll_max_step", "ot", 512], ["unroll_explicit", "ot", 1]]}], "r": [[6.73974e-05], 0, 80.28292870521545, 1601364262.5861647], "v": 0.1}
{"i": ["cuda", "topi_nn_conv2d", [["TENSOR", [1, 160, 17, 17], "float32"], ["TENSOR", [160, 160, 7, 1], "float32"], [1, 1], [3, 0], [1, 1], "NCHW", "float32"], {}, ["conv2d", [1, 160, 17, 17, "float32"], [160, 160, 7, 1, "float32"], [1, 1], [3, 0], [1, 1], "NCHW", "float32"], {"i": 491552, "t": "direct", "c": null, "e": [["tile_f", "sp", [-1, 1, 10, 2]], ["tile_y", "sp", [-1, 1, 17, 1]], ["tile_x", "sp", [-1, 1, 1, 1]], ["tile_rc", "sp", [-1, 10]], ["tile_ry", "sp", [-1, 7]], ["tile_rx", "sp", [-1, 1]], ["auto_unroll_max_step", "ot", 1500], ["unroll_explicit", "ot", 1]]}], "r": [[4.298675e-05], 0, 61.76953911781311, 1601367634.335567], "v": 0.1}
{"i": ["cuda", "topi_nn_conv2d", [["TENSOR", [1, 160, 17, 17], "float32"], ["TENSOR", [192, 160, 1, 7], "float32"], [1, 1], [0, 3], [1, 1], "NCHW", "float32"], {}, ["conv2d", [1, 160, 17, 17, "float32"], [192, 160, 1, 7, "float32"], [1, 1], [0, 3], [1, 1], "NCHW", "float32"], {"i": 217859, "t": "direct", "c": null, "e": [["tile_f", "sp", [-1, 1, 12, 2]], ["tile_y", "sp", [-1, 1, 1, 1]], ["tile_x", "sp", [-1, 1, 17, 1]], ["tile_rc", "sp", [-1, 8]], ["tile_ry", "sp", [-1, 1]], ["tile_rx", "sp", [-1, 7]], ["auto_unroll_max_step", "ot", 512], ["unroll_explicit", "ot", 0]]}], "r": [[4.6633349999999996e-05], 0, 88.59008741378784, 1601371581.7296975], "v": 0.1}
{"i": ["cuda", "topi_nn_conv2d", [["TENSOR", [1, 768, 17, 17], "float32"], ["TENSOR", [160, 768, 1, 1], "float32"], [1, 1], [0, 0], [1, 1], "NCHW", "float32"], {}, ["conv2d", [1, 768, 17, 17, "float32"], [160, 768, 1, 1, "float32"], [1, 1], [0, 0], [1, 1], "NCHW", "float32"], {"i": 360231, "t": "direct", "c": null, "e": [["tile_f", "sp", [-1, 5, 8, 1]], ["tile_y", "sp", [-1, 1, 1, 1]], ["tile_x", "sp", [-1, 1, 17, 1]], ["tile_rc", "sp", [-1, 48]], ["tile_ry", "sp", [-1, 1]], ["tile_rx", "sp", [-1, 1]], ["auto_unroll_max_step", "ot", 1500], ["unroll_explicit", "ot", 1]]}], "r": [[3.51514e-05], 0, 57.47218179702759, 1601373751.5854845], "v": 0.1}
{"i": ["cuda", "topi_nn_conv2d", [["TENSOR", [1, 160, 17, 17], "float32"], ["TENSOR", [160, 160, 1, 7], "float32"], [1, 1], [0, 3], [1, 1], "NCHW", "float32"], {}, ["conv2d", [1, 160, 17, 17, "float32"], [160, 160, 1, 7, "float32"], [1, 1], [0, 3], [1, 1], "NCHW", "float32"], {"i": 59232, "t": "direct", "c": null, "e": [["tile_f", "sp", [-1, 1, 10, 2]], ["tile_y", "sp", [-1, 1, 1, 1]], ["tile_x", "sp", [-1, 1, 17, 1]], ["tile_rc", "sp", [-1, 8]], ["tile_ry", "sp", [-1, 1]], ["tile_rx", "sp", [-1, 7]], ["auto_unroll_max_step", "ot", 0], ["unroll_explicit", "ot", 0]]}], "r": [[4.09181e-05], 0, 78.54160141944885, 1601376800.399547], "v": 0.1}
{"i": ["cuda", "topi_nn_conv2d", [["TENSOR", [1, 160, 17, 17], "float32"], ["TENSOR", [192, 160, 7, 1], "float32"], [1, 1], [3, 0], [1, 1], "NCHW", "float32"], {}, ["conv2d", [1, 160, 17, 17, "float32"], [192, 160, 7, 1, "float32"], [1, 1], [3, 0], [1, 1], "NCHW", "float32"], {"i": 215739, "t": "direct", "c": null, "e": [["tile_f", "sp", [-1, 2, 3, 1]], ["tile_y", "sp", [-1, 1, 17, 1]], ["tile_x", "sp", [-1, 1, 1, 1]], ["tile_rc", "sp", [-1, 8]], ["tile_ry", "sp", [-1, 7]], ["tile_rx", "sp", [-1, 1]], ["auto_unroll_max_step", "ot", 512], ["unroll_explicit", "ot", 0]]}], "r": [[5.194114999999999e-05], 0, 79.18837594985962, 1601379236.6100392], "v": 0.1}
{"i": ["cuda", "topi_nn_conv2d", [["TENSOR", [1, 128, 17, 17], "float32"], ["TENSOR", [128, 128, 7, 1], "float32"], [1, 1], [3, 0], [1, 1], "NCHW", "float32"], {}, ["conv2d", [1, 128, 17, 17, "float32"], [128, 128, 7, 1, "float32"], [1, 1], [3, 0], [1, 1], "NCHW", "float32"], {"i": 144982, "t": "direct", "c": null, "e": [["tile_f", "sp", [-1, 2, 8, 1]], ["tile_y", "sp", [-1, 1, 1, 1]], ["tile_x", "sp", [-1, 1, 17, 1]], ["tile_rc", "sp", [-1, 8]], ["tile_ry", "sp", [-1, 7]], ["tile_rx", "sp", [-1, 1]], ["auto_unroll_max_step", "ot", 512], ["unroll_explicit", "ot", 1]]}], "r": [[3.0454199999999997e-05], 0, 52.029128551483154, 1601381933.8927324], "v": 0.1}
{"i": ["cuda", "topi_nn_conv2d", [["TENSOR", [1, 128, 17, 17], "float32"], ["TENSOR", [192, 128, 1, 7], "float32"], [1, 1], [0, 3], [1, 1], "NCHW", "float32"], {}, ["conv2d", [1, 128, 17, 17, "float32"], [192, 128, 1, 7, "float32"], [1, 1], [0, 3], [1, 1], "NCHW", "float32"], {"i": 61955, "t": "direct", "c": null, "e": [["tile_f", "sp", [-1, 1, 12, 2]], ["tile_y", "sp", [-1, 1, 1, 1]], ["tile_x", "sp", [-1, 1, 17, 1]], ["tile_rc", "sp", [-1, 8]], ["tile_ry", "sp", [-1, 1]], ["tile_rx", "sp", [-1, 7]], ["auto_unroll_max_step", "ot", 0], ["unroll_explicit", "ot", 0]]}], "r": [[3.74707e-05], 0, 69.86023950576782, 1601384562.7249496], "v": 0.1}
{"i": ["cuda", "topi_nn_conv2d", [["TENSOR", [1, 768, 17, 17], "float32"], ["TENSOR", [128, 768, 1, 1], "float32"], [1, 1], [0, 0], [1, 1], "NCHW", "float32"], {}, ["conv2d", [1, 768, 17, 17, "float32"], [128, 768, 1, 1, "float32"], [1, 1], [0, 0], [1, 1], "NCHW", "float32"], {"i": 20187, "t": "direct", "c": null, "e": [["tile_f", "sp", [-1, 2, 16, 1]], ["tile_y", "sp", [-1, 1, 1, 1]], ["tile_x", "sp", [-1, 1, 17, 1]], ["tile_rc", "sp", [-1, 48]], ["tile_ry", "sp", [-1, 1]], ["tile_rx", "sp", [-1, 1]], ["auto_unroll_max_step", "ot", 0], ["unroll_explicit", "ot", 0]]}], "r": [[2.84237e-05], 0, 68.20537185668945, 1601387406.158114], "v": 0.1}
{"i": ["cuda", "topi_nn_conv2d", [["TENSOR", [1, 128, 17, 17], "float32"], ["TENSOR", [128, 128, 1, 7], "float32"], [1, 1], [0, 3], [1, 1], "NCHW", "float32"], {}, ["conv2d", [1, 128, 17, 17, "float32"], [128, 128, 1, 7, "float32"], [1, 1], [0, 3], [1, 1], "NCHW", "float32"], {"i": 52854, "t": "direct", "c": null, "e": [["tile_f", "sp", [-1, 1, 8, 2]], ["tile_y", "sp", [-1, 1, 1, 1]], ["tile_x", "sp", [-1, 1, 17, 1]], ["tile_rc", "sp", [-1, 8]], ["tile_ry", "sp", [-1, 1]], ["tile_rx", "sp", [-1, 7]], ["auto_unroll_max_step", "ot", 512], ["unroll_explicit", "ot", 0]]}], "r": [[2.9660750000000002e-05], 0, 69.3695912361145, 1601389331.124418], "v": 0.1}
{"i": ["cuda", "topi_nn_conv2d", [["TENSOR", [1, 128, 17, 17], "float32"], ["TENSOR", [192, 128, 7, 1], "float32"], [1, 1], [3, 0], [1, 1], "NCHW", "float32"], {}, ["conv2d", [1, 128, 17, 17, "float32"], [192, 128, 7, 1, "float32"], [1, 1], [3, 0], [1, 1], "NCHW", "float32"], {"i": 406562, "t": "direct", "c": null, "e": [["tile_f", "sp", [-1, 3, 1, 1]], ["tile_y", "sp", [-1, 1, 17, 1]], ["tile_x", "sp", [-1, 1, 17, 1]], ["tile_rc", "sp", [-1, 8]], ["tile_ry", "sp", [-1, 7]], ["tile_rx", "sp", [-1, 1]], ["auto_unroll_max_step", "ot", 512], ["unroll_explicit", "ot", 1]]}], "r": [[3.69172e-05], 0, 63.17895555496216, 1601391372.3155742], "v": 0.1}
{"i": ["cuda", "topi_nn_conv2d", [["TENSOR", [1, 96, 35, 35], "float32"], ["TENSOR", [96, 96, 3, 3], "float32"], [2, 2], [0, 0], [1, 1], "NCHW", "float32"], {}, ["conv2d", [1, 96, 35, 35, "float32"], [96, 96, 3, 3, "float32"], [2, 2], [0, 0], [1, 1], "NCHW", "float32"], {"i": 324452, "t": "direct", "c": null, "e": [["tile_f", "sp", [-1, 1, 12, 2]], ["tile_y", "sp", [-1, 1, 1, 1]], ["tile_x", "sp", [-1, 1, 17, 1]], ["tile_rc", "sp", [-1, 12]], ["tile_ry", "sp", [-1, 3]], ["tile_rx", "sp", [-1, 3]], ["auto_unroll_max_step", "ot", 512], ["unroll_explicit", "ot", 0]]}], "r": [[2.5593449999999998e-05], 0, 71.44327569007874, 1601393382.0986435], "v": 0.1}
{"i": ["cuda", "topi_nn_conv2d", [["TENSOR", [1, 288, 35, 35], "float32"], ["TENSOR", [48, 288, 1, 1], "float32"], [1, 1], [0, 0], [1, 1], "NCHW", "float32"], {}, ["conv2d", [1, 288, 35, 35, "float32"], [48, 288, 1, 1, "float32"], [1, 1], [0, 0], [1, 1], "NCHW", "float32"], {"i": 1662984, "t": "direct", "c": null, "e": [["tile_f", "sp", [-1, 2, 4, 2]], ["tile_y", "sp", [-1, 1, 7, 1]], ["tile_x", "sp", [-1, 1, 7, 1]], ["tile_rc", "sp", [-1, 24]], ["tile_ry", "sp", [-1, 1]], ["tile_rx", "sp", [-1, 1]], ["auto_unroll_max_step", "ot", 1500], ["unroll_explicit", "ot", 0]]}], "r": [[1.43733e-05], 0, 11.266948699951172, 1601394913.9218976], "v": 0.1}
{"i": ["cuda", "topi_nn_conv2d", [["TENSOR", [1, 256, 35, 35], "float32"], ["TENSOR", [48, 256, 1, 1], "float32"], [1, 1], [0, 0], [1, 1], "NCHW", "float32"], {}, ["conv2d", [1, 256, 35, 35, "float32"], [48, 256, 1, 1, "float32"], [1, 1], [0, 0], [1, 1], "NCHW", "float32"], {"i": 802567, "t": "direct", "c": null, "e": [["tile_f", "sp", [-1, 1, 8, 3]], ["tile_y", "sp", [-1, 1, 5, 1]], ["tile_x", "sp", [-1, 1, 7, 1]], ["tile_rc", "sp", [-1, 16]], ["tile_ry", "sp", [-1, 1]], ["tile_rx", "sp", [-1, 1]], ["auto_unroll_max_step", "ot", 1500], ["unroll_explicit", "ot", 0]]}], "r": [[1.403195e-05], 0, 21.730070114135742, 1601396056.8927412], "v": 0.1}
{"i": ["cuda", "topi_nn_conv2d", [["TENSOR", [1, 192, 35, 35], "float32"], ["TENSOR", [32, 192, 1, 1], "float32"], [1, 1], [0, 0], [1, 1], "NCHW", "float32"], {}, ["conv2d", [1, 192, 35, 35, "float32"], [32, 192, 1, 1, "float32"], [1, 1], [0, 0], [1, 1], "NCHW", "float32"], {"i": 1079025, "t": "direct", "c": null, "e": [["tile_f", "sp", [-1, 4, 8, 1]], ["tile_y", "sp", [-1, 1, 5, 1]], ["tile_x", "sp", [-1, 1, 5, 1]], ["tile_rc", "sp", [-1, 8]], ["tile_ry", "sp", [-1, 1]], ["tile_rx", "sp", [-1, 1]], ["auto_unroll_max_step", "ot", 1500], ["unroll_explicit", "ot", 1]]}], "r": [[9.39565e-06], 0, 22.3801851272583, 1601397829.5014656], "v": 0.1}
{"i": ["cuda", "topi_nn_conv2d", [["TENSOR", [1, 64, 35, 35], "float32"], ["TENSOR", [96, 64, 3, 3], "float32"], [1, 1], [1, 1], [1, 1], "NCHW", "float32"], {}, ["conv2d", [1, 64, 35, 35, "float32"], [96, 64, 3, 3, "float32"], [1, 1], [1, 1], [1, 1], "NCHW", "float32"], {"i": 9313285, "t": "direct", "c": null, "e": [["tile_f", "sp", [-1, 2, 6, 1]], ["tile_y", "sp", [-1, 1, 1, 5]], ["tile_x", "sp", [-1, 1, 7, 1]], ["tile_rc", "sp", [-1, 2]], ["tile_ry", "sp", [-1, 3]], ["tile_rx", "sp", [-1, 3]], ["auto_unroll_max_step", "ot", 1500], ["unroll_explicit", "ot", 1]]}], "r": [[3.487495e-05], 0, 8.009517192840576, 1601398421.1195529], "v": 0.1}
{"i": ["cuda", "topi_nn_conv2d", [["TENSOR", [1, 96, 35, 35], "float32"], ["TENSOR", [96, 96, 3, 3], "float32"], [1, 1], [1, 1], [1, 1], "NCHW", "float32"], {}, ["conv2d", [1, 96, 35, 35, "float32"], [96, 96, 3, 3, "float32"], [1, 1], [1, 1], [1, 1], "NCHW", "float32"], {"i": 16193943, "t": "direct", "c": null, "e": [["tile_f", "sp", [-1, 2, 4, 2]], ["tile_y", "sp", [-1, 1, 7, 1]], ["tile_x", "sp", [-1, 1, 7, 1]], ["tile_rc", "sp", [-1, 12]], ["tile_ry", "sp", [-1, 3]], ["tile_rx", "sp", [-1, 3]], ["auto_unroll_max_step", "ot", 1500], ["unroll_explicit", "ot", 1]]}], "r": [[4.8886950000000005e-05], 0, 31.380122184753418, 1601400047.2799265], "v": 0.1}
{"i": ["cuda", "topi_nn_conv2d", [["TENSOR", [1, 192, 35, 35], "float32"], ["TENSOR", [48, 192, 1, 1], "float32"], [1, 1], [0, 0], [1, 1], "NCHW", "float32"], {}, ["conv2d", [1, 192, 35, 35, "float32"], [48, 192, 1, 1, "float32"], [1, 1], [0, 0], [1, 1], "NCHW", "float32"], {"i": 1263954, "t": "direct", "c": null, "e": [["tile_f", "sp", [-1, 2, 8, 1]], ["tile_y", "sp", [-1, 1, 5, 1]], ["tile_x", "sp", [-1, 1, 5, 1]], ["tile_rc", "sp", [-1, 16]], ["tile_ry", "sp", [-1, 1]], ["tile_rx", "sp", [-1, 1]], ["auto_unroll_max_step", "ot", 1500], ["unroll_explicit", "ot", 0]]}], "r": [[1.194195e-05], 0, 51.921627044677734, 1601400638.7389863], "v": 0.1}
{"i": ["cuda", "topi_nn_conv2d", [["TENSOR", [1, 48, 35, 35], "float32"], ["TENSOR", [64, 48, 5, 5], "float32"], [1, 1], [2, 2], [1, 1], "NCHW", "float32"], {}, ["conv2d", [1, 48, 35, 35, "float32"], [64, 48, 5, 5, "float32"], [1, 1], [2, 2], [1, 1], "NCHW", "float32"], {"i": 5048586, "t": "direct", "c": null, "e": [["tile_f", "sp", [-1, 1, 8, 1]], ["tile_y", "sp", [-1, 1, 7, 1]], ["tile_x", "sp", [-1, 1, 1, 7]], ["tile_rc", "sp", [-1, 6]], ["tile_ry", "sp", [-1, 5]], ["tile_rx", "sp", [-1, 5]], ["auto_unroll_max_step", "ot", 1500], ["unroll_explicit", "ot", 1]]}], "r": [[4.76103e-05], 0, 55.1884880065918, 1601401661.4136343], "v": 0.1}
{"i": ["cuda", "topi_nn_conv2d", [["TENSOR", [1, 3, 299, 299], "float32"], ["TENSOR", [32, 3, 3, 3], "float32"], [2, 2], [0, 0], [1, 1], "NCHW", "float32"], {}, ["conv2d", [1, 3, 299, 299, "float32"], [32, 3, 3, 3, "float32"], [2, 2], [0, 0], [1, 1], "NCHW", "float32"], {"i": 21098, "t": "direct", "c": null, "e": [["tile_f", "sp", [-1, 4, 2, 4]], ["tile_y", "sp", [-1, 1, 1, 1]], ["tile_x", "sp", [-1, 1, 149, 1]], ["tile_rc", "sp", [-1, 3]], ["tile_ry", "sp", [-1, 3]], ["tile_rx", "sp", [-1, 3]], ["auto_unroll_max_step", "ot", 1500], ["unroll_explicit", "ot", 0]]}], "r": [[9.2666e-06], 0, 18.45890164375305, 1601402958.1212919], "v": 0.1}
{"i": ["cuda", "topi_nn_conv2d", [["TENSOR", [1, 32, 149, 149], "float32"], ["TENSOR", [32, 32, 3, 3], "float32"], [1, 1], [0, 0], [1, 1], "NCHW", "float32"], {}, ["conv2d", [1, 32, 149, 149, "float32"], [32, 32, 3, 3, "float32"], [1, 1], [0, 0], [1, 1], "NCHW", "float32"], {"i": 12564734, "t": "direct", "c": null, "e": [["tile_f", "sp", [-1, 8, 4, 1]], ["tile_y", "sp", [-1, 3, 7, 1]], ["tile_x", "sp", [-1, 1, 7, 1]], ["tile_rc", "sp", [-1, 4]], ["tile_ry", "sp", [-1, 3]], ["tile_rx", "sp", [-1, 3]], ["auto_unroll_max_step", "ot", 1500], ["unroll_explicit", "ot", 1]]}], "r": [[5.3204550000000005e-05], 0, 30.333404064178467, 1601404477.7207787], "v": 0.1}
{"i": ["cuda", "topi_nn_conv2d", [["TENSOR", [1, 32, 147, 147], "float32"], ["TENSOR", [64, 32, 3, 3], "float32"], [1, 1], [1, 1], [1, 1], "NCHW", "float32"], {}, ["conv2d", [1, 32, 147, 147, "float32"], [64, 32, 3, 3, "float32"], [1, 1], [1, 1], [1, 1], "NCHW", "float32"], {"i": 8942498, "t": "direct", "c": null, "e": [["tile_f", "sp", [-1, 2, 32, 1]], ["tile_y", "sp", [-1, 1, 1, 3]], ["tile_x", "sp", [-1, 1, 7, 3]], ["tile_rc", "sp", [-1, 1]], ["tile_ry", "sp", [-1, 3]], ["tile_rx", "sp", [-1, 3]], ["auto_unroll_max_step", "ot", 1500], ["unroll_explicit", "ot", 0]]}], "r": [[9.982655000000001e-05], 0, 44.343138694763184, 1601405322.1122622], "v": 0.1}
{"i": ["cuda", "topi_nn_conv2d", [["TENSOR", [1, 64, 73, 73], "float32"], ["TENSOR", [80, 64, 1, 1], "float32"], [1, 1], [0, 0], [1, 1], "NCHW", "float32"], {}, ["conv2d", [1, 64, 73, 73, "float32"], [80, 64, 1, 1, "float32"], [1, 1], [0, 0], [1, 1], "NCHW", "float32"], {"i": 88586, "t": "direct", "c": null, "e": [["tile_f", "sp", [-1, 2, 8, 5]], ["tile_y", "sp", [-1, 1, 1, 1]], ["tile_x", "sp", [-1, 1, 73, 1]], ["tile_rc", "sp", [-1, 16]], ["tile_ry", "sp", [-1, 1]], ["tile_rx", "sp", [-1, 1]], ["auto_unroll_max_step", "ot", 1500], ["unroll_explicit", "ot", 1]]}], "r": [[1.2174900000000001e-05], 0, 24.48799705505371, 1601406745.2018826], "v": 0.1}
{"i": ["cuda", "topi_nn_conv2d", [["TENSOR", [1, 80, 73, 73], "float32"], ["TENSOR", [192, 80, 3, 3], "float32"], [1, 1], [0, 0], [1, 1], "NCHW", "float32"], {}, ["conv2d", [1, 80, 73, 73, "float32"], [192, 80, 3, 3, "float32"], [1, 1], [0, 0], [1, 1], "NCHW", "float32"], {"i": 599533, "t": "direct", "c": null, "e": [["tile_f", "sp", [-1, 8, 3, 2]], ["tile_y", "sp", [-1, 1, 1, 1]], ["tile_x", "sp", [-1, 1, 71, 1]], ["tile_rc", "sp", [-1, 2]], ["tile_ry", "sp", [-1, 3]], ["tile_rx", "sp", [-1, 3]], ["auto_unroll_max_step", "ot", 1500], ["unroll_explicit", "ot", 0]]}], "r": [[0.00018454965], 0, 28.482985496520996, 1601408205.569001], "v": 0.1}
{"i": ["cuda", "topi_nn_conv2d", [["TENSOR", [1, 192, 35, 35], "float32"], ["TENSOR", [64, 192, 1, 1], "float32"], [1, 1], [0, 0], [1, 1], "NCHW", "float32"], {}, ["conv2d", [1, 192, 35, 35, "float32"], [64, 192, 1, 1, "float32"], [1, 1], [0, 0], [1, 1], "NCHW", "float32"], {"i": 1425164, "t": "direct", "c": null, "e": [["tile_f", "sp", [-1, 4, 8, 1]], ["tile_y", "sp", [-1, 1, 7, 1]], ["tile_x", "sp", [-1, 1, 5, 1]], ["tile_rc", "sp", [-1, 48]], ["tile_ry", "sp", [-1, 1]], ["tile_rx", "sp", [-1, 1]], ["auto_unroll_max_step", "ot", 512], ["unroll_explicit", "ot", 1]]}], "r": [[1.392325e-05], 0, 46.39333915710449, 1601409570.989831], "v": 0.1}
{"i": ["cuda", "topi_nn_conv2d", [["TENSOR", [1, 256, 35, 35], "float32"], ["TENSOR", [64, 256, 1, 1], "float32"], [1, 1], [0, 0], [1, 1], "NCHW", "float32"], {}, ["conv2d", [1, 256, 35, 35, "float32"], [64, 256, 1, 1, "float32"], [1, 1], [0, 0], [1, 1], "NCHW", "float32"], {"i": 96783, "t": "direct", "c": null, "e": [["tile_f", "sp", [-1, 4, 4, 1]], ["tile_y", "sp", [-1, 1, 1, 1]], ["tile_x", "sp", [-1, 1, 35, 1]], ["tile_rc", "sp", [-1, 16]], ["tile_ry", "sp", [-1, 1]], ["tile_rx", "sp", [-1, 1]], ["auto_unroll_max_step", "ot", 0], ["unroll_explicit", "ot", 0]]}], "r": [[1.599215e-05], 0, 19.586180686950684, 1601410664.0008335], "v": 0.1}
{"i": ["cuda", "topi_nn_conv2d", [["TENSOR", [1, 288, 35, 35], "float32"], ["TENSOR", [64, 288, 1, 1], "float32"], [1, 1], [0, 0], [1, 1], "NCHW", "float32"], {}, ["conv2d", [1, 288, 35, 35, "float32"], [64, 288, 1, 1, "float32"], [1, 1], [0, 0], [1, 1], "NCHW", "float32"], {"i": 956972, "t": "direct", "c": null, "e": [["tile_f", "sp", [-1, 2, 8, 2]], ["tile_y", "sp", [-1, 1, 1, 1]], ["tile_x", "sp", [-1, 1, 35, 1]], ["tile_rc", "sp", [-1, 16]], ["tile_ry", "sp", [-1, 1]], ["tile_rx", "sp", [-1, 1]], ["auto_unroll_max_step", "ot", 1500], ["unroll_explicit", "ot", 0]]}], "r": [[1.590585e-05], 0, 26.791126489639282, 1601412434.94938], "v": 0.1}
{"i": ["cuda", "topi_nn_conv2d", [["TENSOR", [1, 288, 35, 35], "float32"], ["TENSOR", [384, 288, 3, 3], "float32"], [2, 2], [0, 0], [1, 1], "NCHW", "float32"], {}, ["conv2d", [1, 288, 35, 35, "float32"], [384, 288, 3, 3, "float32"], [2, 2], [0, 0], [1, 1], "NCHW", "float32"], {"i": 426309, "t": "direct", "c": null, "e": [["tile_f", "sp", [-1, 4, 12, 1]], ["tile_y", "sp", [-1, 1, 1, 1]], ["tile_x", "sp", [-1, 1, 17, 1]], ["tile_rc", "sp", [-1, 2]], ["tile_ry", "sp", [-1, 3]], ["tile_rx", "sp", [-1, 3]], ["auto_unroll_max_step", "ot", 0], ["unroll_explicit", "ot", 0]]}], "r": [[0.0002052443], 0, 24.139683723449707, 1601414125.6413095], "v": 0.1}
{"i": ["cuda", "topi_nn_conv2d", [["TENSOR", [1, 768, 17, 17], "float32"], ["TENSOR", [192, 768, 1, 1], "float32"], [1, 1], [0, 0], [1, 1], "NCHW", "float32"], {}, ["conv2d", [1, 768, 17, 17, "float32"], [192, 768, 1, 1, "float32"], [1, 1], [0, 0], [1, 1], "NCHW", "float32"], {"i": 524325, "t": "direct", "c": null, "e": [["tile_f", "sp", [-1, 1, 8, 3]], ["tile_y", "sp", [-1, 1, 1, 1]], ["tile_x", "sp", [-1, 1, 17, 1]], ["tile_rc", "sp", [-1, 16]], ["tile_ry", "sp", [-1, 1]], ["tile_rx", "sp", [-1, 1]], ["auto_unroll_max_step", "ot", 1500], ["unroll_explicit", "ot", 1]]}], "r": [[3.50665e-05], 0, 31.063289642333984, 1601416059.3722963], "v": 0.1}
{"i": ["cuda", "topi_nn_conv2d", [["TENSOR", [1, 192, 17, 17], "float32"], ["TENSOR", [320, 192, 3, 3], "float32"], [2, 2], [0, 0], [1, 1], "NCHW", "float32"], {}, ["conv2d", [1, 192, 17, 17, "float32"], [320, 192, 3, 3, "float32"], [2, 2], [0, 0], [1, 1], "NCHW", "float32"], {"i": 36336427, "t": "direct", "c": null, "e": [["tile_f", "sp", [-1, 1, 8, 1]], ["tile_y", "sp", [-1, 1, 2, 1]], ["tile_x", "sp", [-1, 1, 4, 1]], ["tile_rc", "sp", [-1, 6]], ["tile_ry", "sp", [-1, 3]], ["tile_rx", "sp", [-1, 3]], ["auto_unroll_max_step", "ot", 512], ["unroll_explicit", "ot", 1]]}], "r": [[3.49888e-05], 0, 23.439205169677734, 1601416888.8892207], "v": 0.1}
{"i": ["cuda", "topi_nn_conv2d", [["TENSOR", [1, 2048, 8, 8], "float32"], ["TENSOR", [320, 2048, 1, 1], "float32"], [1, 1], [0, 0], [1, 1], "NCHW", "float32"], {}, ["conv2d", [1, 2048, 8, 8, "float32"], [320, 2048, 1, 1, "float32"], [1, 1], [0, 0], [1, 1], "NCHW", "float32"], {"i": 8663467, "t": "direct", "c": null, "e": [["tile_f", "sp", [-1, 1, 8, 1]], ["tile_y", "sp", [-1, 1, 2, 1]], ["tile_x", "sp", [-1, 1, 8, 1]], ["tile_rc", "sp", [-1, 16]], ["tile_ry", "sp", [-1, 1]], ["tile_rx", "sp", [-1, 1]], ["auto_unroll_max_step", "ot", 1500], ["unroll_explicit", "ot", 1]]}], "r": [[3.92821e-05], 0, 38.064751625061035, 1601420528.8885999], "v": 0.1}
