experiments/latency/tvm_schedule_configs/nasnet_large_None_1.log
{"i": ["cuda", "topi_nn_depthwise_conv2d_nchw", [["TENSOR", [1, 672, 11, 11], "float32"], ["TENSOR", [672, 1, 3, 3], "float32"], [1, 1], [1, 1], [1, 1], "float32"], {}, ["depthwise_conv2d_nchw", [1, 672, 11, 11, "float32"], [672, 1, 3, 3, "float32"], [1, 1], [1, 1], [1, 1], "float32"], {"i": 52040, "t": "direct", "c": null, "e": [["tile_f", "sp", [-1, 1, 6, 1]], ["tile_y", "sp", [-1, 1, 11, 1]], ["tile_x", "sp", [-1, 1, 11, 1]], ["auto_unroll_max_step", "ot", 0], ["unroll_explicit", "ot", 1]]}], "r": [[3.925e-06], 0, 83.74066829681396, 1601331231.601535], "v": 0.1}
{"i": ["cuda", "topi_nn_depthwise_conv2d_nchw", [["TENSOR", [1, 672, 21, 21], "float32"], ["TENSOR", [672, 1, 5, 5], "float32"], [2, 2], [2, 2], [1, 1], "float32"], {}, ["depthwise_conv2d_nchw", [1, 672, 21, 21, "float32"], [672, 1, 5, 5, "float32"], [2, 2], [2, 2], [1, 1], "float32"], {"i": 66304, "t": "direct", "c": null, "e": [["tile_f", "sp", [-1, 1, 1, 1]], ["tile_y", "sp", [-1, 1, 11, 1]], ["tile_x", "sp", [-1, 1, 11, 1]], ["auto_unroll_max_step", "ot", 256], ["unroll_explicit", "ot", 1]]}], "r": [[5.41465e-06], 0, 83.64393782615662, 1601333786.335129], "v": 0.1}
{"i": ["cuda", "topi_nn_depthwise_conv2d_nchw", [["TENSOR", [1, 672, 21, 21], "float32"], ["TENSOR", [672, 1, 7, 7], "float32"], [2, 2], [3, 3], [1, 1], "float32"], {}, ["depthwise_conv2d_nchw", [1, 672, 21, 21, "float32"], [672, 1, 7, 7, "float32"], [2, 2], [3, 3], [1, 1], "float32"], {"i": 66304, "t": "direct", "c": null, "e": [["tile_f", "sp", [-1, 1, 1, 1]], ["tile_y", "sp", [-1, 1, 11, 1]], ["tile_x", "sp", [-1, 1, 11, 1]], ["auto_unroll_max_step", "ot", 256], ["unroll_explicit", "ot", 1]]}], "r": [[5.79785e-06], 0, 89.78443121910095, 1601335236.7371936], "v": 0.1}
{"i": ["cuda", "topi_nn_depthwise_conv2d_nchw", [["TENSOR", [1, 672, 11, 11], "float32"], ["TENSOR", [672, 1, 7, 7], "float32"], [1, 1], [3, 3], [1, 1], "float32"], {}, ["depthwise_conv2d_nchw", [1, 672, 11, 11, "float32"], [672, 1, 7, 7, "float32"], [1, 1], [3, 3], [1, 1], "float32"], {"i": 66628, "t": "direct", "c": null, "e": [["tile_f", "sp", [-1, 1, 1, 3]], ["tile_y", "sp", [-1, 1, 11, 1]], ["tile_x", "sp", [-1, 1, 11, 1]], ["auto_unroll_max_step", "ot", 256], ["unroll_explicit", "ot", 1]]}], "r": [[6.591400000000001e-06], 0, 84.35605931282043, 1601338082.461632], "v": 0.1}
{"i": ["cuda", "topi_nn_conv2d", [["TENSOR", [1, 1680, 21, 21], "float32"], ["TENSOR", [672, 1680, 1, 1], "float32"], [1, 1], [0, 0], [1, 1], "NCHW", "float32"], {}, ["conv2d", [1, 1680, 21, 21, "float32"], [672, 1680, 1, 1, "float32"], [1, 1], [0, 0], [1, 1], "NCHW", "float32"], {"i": 49438840, "t": "direct", "c": null, "e": [["tile_f", "sp", [-1, 2, 6, 2]], ["tile_y", "sp", [-1, 1, 1, 3]], ["tile_x", "sp", [-1, 1, 21, 1]], ["tile_rc", "sp", [-1, 24]], ["tile_ry", "sp", [-1, 1]], ["tile_rx", "sp", [-1, 1]], ["auto_unroll_max_step", "ot", 1500], ["unroll_explicit", "ot", 1]]}], "r": [[0.000186187], 0, 93.31502103805542, 1601340962.286026], "v": 0.1}
{"i": ["cuda", "topi_nn_conv2d", [["TENSOR", [1, 2688, 11, 11], "float32"], ["TENSOR", [672, 2688, 1, 1], "float32"], [1, 1], [0, 0], [1, 1], "NCHW", "float32"], {}, ["conv2d", [1, 2688, 11, 11, "float32"], [672, 2688, 1, 1, "float32"], [1, 1], [0, 0], [1, 1], "NCHW", "float32"], {"i": 2532169, "t": "direct", "c": null, "e": [["tile_f", "sp", [-1, 2, 6, 1]], ["tile_y", "sp", [-1, 1, 11, 1]], ["tile_x", "sp", [-1, 1, 11, 1]], ["tile_rc", "sp", [-1, 56]], ["tile_ry", "sp", [-1, 1]], ["tile_rx", "sp", [-1, 1]], ["auto_unroll_max_step", "ot", 1500], ["unroll_explicit", "ot", 1]]}], "r": [[0.00017358009999999998], 0, 87.15655827522278, 1601343275.6204789], "v": 0.1}
{"i": ["cuda", "topi_nn_depthwise_conv2d_nchw", [["TENSOR", [1, 336, 21, 21], "float32"], ["TENSOR", [336, 1, 3, 3], "float32"], [1, 1], [1, 1], [1, 1], "float32"], {}, ["depthwise_conv2d_nchw", [1, 336, 21, 21, "float32"], [336, 1, 3, 3, "float32"], [1, 1], [1, 1], [1, 1], "float32"], {"i": 792065, "t": "direct", "c": null, "e": [["tile_f", "sp", [-1, 1, 1, 3]], ["tile_y", "sp", [-1, 1, 7, 1]], ["tile_x", "sp", [-1, 1, 21, 1]], ["auto_unroll_max_step", "ot", 1500], ["unroll_explicit", "ot", 1]]}], "r": [[4.886e-06], 0, 78.9828155040741, 1601345794.6262949], "v": 0.1}
{"i": ["cuda", "topi_nn_depthwise_conv2d_nchw", [["TENSOR", [1, 336, 42, 42], "float32"], ["TENSOR", [336, 1, 5, 5], "float32"], [2, 2], [2, 2], [1, 1], "float32"], {}, ["depthwise_conv2d_nchw", [1, 336, 42, 42, "float32"], [336, 1, 5, 5, "float32"], [2, 2], [2, 2], [1, 1], "float32"], {"i": 789600, "t": "direct", "c": null, "e": [["tile_f", "sp", [-1, 1, 1, 1]], ["tile_y", "sp", [-1, 7, 1, 1]], ["tile_x", "sp", [-1, 1, 21, 1]], ["auto_unroll_max_step", "ot", 1500], ["unroll_explicit", "ot", 1]]}], "r": [[6.28625e-06], 0, 89.18335628509521, 1601348072.1460435], "v": 0.1}
{"i": ["cuda", "topi_nn_depthwise_conv2d_nchw", [["TENSOR", [1, 336, 42, 42], "float32"], ["TENSOR", [336, 1, 7, 7], "float32"], [2, 2], [3, 3], [1, 1], "float32"], {}, ["depthwise_conv2d_nchw", [1, 336, 42, 42, "float32"], [336, 1, 7, 7, "float32"], [2, 2], [3, 3], [1, 1], "float32"], {"i": 651280, "t": "direct", "c": null, "e": [["tile_f", "sp", [-1, 1, 1, 1]], ["tile_y", "sp", [-1, 1, 7, 3]], ["tile_x", "sp", [-1, 1, 21, 1]], ["auto_unroll_max_step", "ot", 256], ["unroll_explicit", "ot", 1]]}], "r": [[8.7184e-06], 0, 73.18174839019775, 1601349960.0392532], "v": 0.1}
{"i": ["cuda", "topi_nn_depthwise_conv2d_nchw", [["TENSOR", [1, 336, 21, 21], "float32"], ["TENSOR", [336, 1, 7, 7], "float32"], [1, 1], [3, 3], [1, 1], "float32"], {}, ["depthwise_conv2d_nchw", [1, 336, 21, 21, "float32"], [336, 1, 7, 7, "float32"], [1, 1], [3, 3], [1, 1], "float32"], {"i": 776766, "t": "direct", "c": null, "e": [["tile_f", "sp", [-1, 1, 4, 1]], ["tile_y", "sp", [-1, 1, 7, 3]], ["tile_x", "sp", [-1, 1, 7, 1]], ["auto_unroll_max_step", "ot", 1500], ["unroll_explicit", "ot", 1]]}], "r": [[6.9352999999999995e-06], 0, 46.154048681259155, 1601352267.8111253], "v": 0.1}
{"i": ["cuda", "topi_nn_conv2d", [["TENSOR", [1, 840, 42, 42], "float32"], ["TENSOR", [336, 840, 1, 1], "float32"], [1, 1], [0, 0], [1, 1], "NCHW", "float32"], {}, ["conv2d", [1, 840, 42, 42, "float32"], [336, 840, 1, 1, "float32"], [1, 1], [0, 0], [1, 1], "NCHW", "float32"], {"i": 383871699, "t": "direct", "c": null, "e": [["tile_f", "sp", [-1, 3, 16, 1]], ["tile_y", "sp", [-1, 1, 1, 6]], ["tile_x", "sp", [-1, 1, 14, 1]], ["tile_rc", "sp", [-1, 8]], ["tile_ry", "sp", [-1, 1]], ["tile_rx", "sp", [-1, 1]], ["auto_unroll_max_step", "ot", 1500], ["unroll_explicit", "ot", 1]]}], "r": [[0.0001313682], 0, 91.40947675704956, 1601355914.1166775], "v": 0.1}
{"i": ["cuda", "topi_nn_conv2d", [["TENSOR", [1, 1344, 21, 21], "float32"], ["TENSOR", [336, 1344, 1, 1], "float32"], [1, 1], [0, 0], [1, 1], "NCHW", "float32"], {}, ["conv2d", [1, 1344, 21, 21, "float32"], [336, 1344, 1, 1, "float32"], [1, 1], [0, 0], [1, 1], "NCHW", "float32"], {"i": 5369357, "t": "direct", "c": null, "e": [["tile_f", "sp", [-1, 2, 8, 1]], ["tile_y", "sp", [-1, 1, 3, 1]], ["tile_x", "sp", [-1, 3, 7, 1]], ["tile_rc", "sp", [-1, 16]], ["tile_ry", "sp", [-1, 1]], ["tile_rx", "sp", [-1, 1]], ["auto_unroll_max_step", "ot", 512], ["unroll_explicit", "ot", 0]]}], "r": [[9.430155e-05], 0, 92.85731315612793, 1601357246.673059], "v": 0.1}
{"i": ["cuda", "topi_nn_depthwise_conv2d_nchw", [["TENSOR", [1, 168, 42, 42], "float32"], ["TENSOR", [168, 1, 3, 3], "float32"], [1, 1], [1, 1], [1, 1], "float32"], {}, ["depthwise_conv2d_nchw", [1, 168, 42, 42, "float32"], [168, 1, 3, 3, "float32"], [1, 1], [1, 1], [1, 1], "float32"], {"i": 5785296, "t": "direct", "c": null, "e": [["tile_f", "sp", [-1, 1, 2, 1]], ["tile_y", "sp", [-1, 1, 3, 2]], ["tile_x", "sp", [-1, 1, 42, 1]], ["auto_unroll_max_step", "ot", 256], ["unroll_explicit", "ot", 1]]}], "r": [[5.6938000000000004e-06], 0, 78.60572481155396, 1601359246.6060448], "v": 0.1}
{"i": ["cuda", "topi_nn_depthwise_conv2d_nchw", [["TENSOR", [1, 84, 42, 42], "float32"], ["TENSOR", [84, 1, 3, 3], "float32"], [1, 1], [1, 1], [1, 1], "float32"], {}, ["depthwise_conv2d_nchw", [1, 84, 42, 42, "float32"], [84, 1, 3, 3, "float32"], [1, 1], [1, 1], [1, 1], "float32"], {"i": 3548320, "t": "direct", "c": null, "e": [["tile_f", "sp", [-1, 1, 1, 1]], ["tile_y", "sp", [-1, 1, 7, 2]], ["tile_x", "sp", [-1, 1, 42, 1]], ["auto_unroll_max_step", "ot", 1500], ["unroll_explicit", "ot", 1]]}], "r": [[3.94355e-06], 0, 73.34061908721924, 1601362993.4443712], "v": 0.1}
{"i": ["cuda", "topi_nn_depthwise_conv2d_nchw", [["TENSOR", [1, 84, 83, 83], "float32"], ["TENSOR", [84, 1, 5, 5], "float32"], [2, 2], [2, 2], [1, 1], "float32"], {}, ["depthwise_conv2d_nchw", [1, 84, 83, 83, "float32"], [84, 1, 5, 5, "float32"], [2, 2], [2, 2], [1, 1], "float32"], {"i": 3528481, "t": "direct", "c": null, "e": [["tile_f", "sp", [-1, 2, 1, 1]], ["tile_y", "sp", [-1, 2, 1, 3]], ["tile_x", "sp", [-1, 1, 21, 1]], ["auto_unroll_max_step", "ot", 1500], ["unroll_explicit", "ot", 1]]}], "r": [[6.846600000000001e-06], 0, 75.96671080589294, 1601364689.0315547], "v": 0.1}
{"i": ["cuda", "topi_nn_depthwise_conv2d_nchw", [["TENSOR", [1, 84, 42, 42], "float32"], ["TENSOR", [84, 1, 5, 5], "float32"], [1, 1], [2, 2], [1, 1], "float32"], {}, ["depthwise_conv2d_nchw", [1, 84, 42, 42, "float32"], [84, 1, 5, 5, "float32"], [1, 1], [2, 2], [1, 1], "float32"], {"i": 3618560, "t": "direct", "c": null, "e": [["tile_f", "sp", [-1, 1, 1, 1]], ["tile_y", "sp", [-1, 1, 21, 1]], ["tile_x", "sp", [-1, 1, 7, 2]], ["auto_unroll_max_step", "ot", 1500], ["unroll_explicit", "ot", 1]]}], "r": [[5.29075e-06], 0, 73.59444785118103, 1601366044.0958476], "v": 0.1}
{"i": ["cuda", "topi_nn_conv2d", [["TENSOR", [1, 84, 42, 42], "float32"], ["TENSOR", [84, 84, 1, 1], "float32"], [1, 1], [0, 0], [1, 1], "NCHW", "float32"], {}, ["conv2d", [1, 84, 42, 42, "float32"], [84, 84, 1, 1, "float32"], [1, 1], [0, 0], [1, 1], "NCHW", "float32"], {"i": 46103145, "t": "direct", "c": null, "e": [["tile_f", "sp", [-1, 1, 7, 4]], ["tile_y", "sp", [-1, 1, 6, 1]], ["tile_x", "sp", [-1, 1, 14, 1]], ["tile_rc", "sp", [-1, 42]], ["tile_ry", "sp", [-1, 1]], ["tile_rx", "sp", [-1, 1]], ["auto_unroll_max_step", "ot", 1500], ["unroll_explicit", "ot", 1]]}], "r": [[8.516449999999999e-06], 0, 80.40435361862183, 1601369943.102991], "v": 0.1}
{"i": ["cuda", "topi_nn_depthwise_conv2d_nchw", [["TENSOR", [1, 42, 83, 83], "float32"], ["TENSOR", [42, 1, 5, 5], "float32"], [2, 2], [2, 2], [1, 1], "float32"], {}, ["depthwise_conv2d_nchw", [1, 42, 83, 83, "float32"], [42, 1, 5, 5, "float32"], [2, 2], [2, 2], [1, 1], "float32"], {"i": 1419008, "t": "direct", "c": null, "e": [["tile_f", "sp", [-1, 1, 1, 1]], ["tile_y", "sp", [-1, 3, 1, 2]], ["tile_x", "sp", [-1, 1, 42, 1]], ["auto_unroll_max_step", "ot", 1500], ["unroll_explicit", "ot", 1]]}], "r": [[4.97085e-06], 0, 83.10967016220093, 1601373610.5204208], "v": 0.1}
{"i": ["cuda", "topi_nn_depthwise_conv2d_nchw", [["TENSOR", [1, 42, 42, 42], "float32"], ["TENSOR", [42, 1, 5, 5], "float32"], [1, 1], [2, 2], [1, 1], "float32"], {}, ["depthwise_conv2d_nchw", [1, 42, 42, 42, "float32"], [42, 1, 5, 5, "float32"], [1, 1], [2, 2], [1, 1], "float32"], {"i": 894912, "t": "direct", "c": null, "e": [["tile_f", "sp", [-1, 1, 1, 1]], ["tile_y", "sp", [-1, 1, 3, 2]], ["tile_x", "sp", [-1, 1, 42, 1]], ["auto_unroll_max_step", "ot", 0], ["unroll_explicit", "ot", 1]]}], "r": [[3.91545e-06], 0, 73.59397625923157, 1601376341.897331], "v": 0.1}
{"i": ["cuda", "topi_nn_conv2d", [["TENSOR", [1, 96, 165, 165], "float32"], ["TENSOR", [42, 96, 1, 1], "float32"], [2, 2], [0, 0], [1, 1], "NCHW", "float32"], {}, ["conv2d", [1, 96, 165, 165, "float32"], [42, 96, 1, 1, "float32"], [2, 2], [0, 0], [1, 1], "NCHW", "float32"], {"i": 20023, "t": "direct", "c": null, "e": [["tile_f", "sp", [-1, 2, 3, 7]], ["tile_y", "sp", [-1, 1, 1, 1]], ["tile_x", "sp", [-1, 1, 83, 1]], ["tile_rc", "sp", [-1, 16]], ["tile_ry", "sp", [-1, 1]], ["tile_rx", "sp", [-1, 1]], ["auto_unroll_max_step", "ot", 512], ["unroll_explicit", "ot", 0]]}], "r": [[2.22843e-05], 0, 69.86052560806274, 1601379348.5572383], "v": 0.1}
{"i": ["cuda", "topi_nn_depthwise_conv2d_nchw", [["TENSOR", [1, 42, 83, 83], "float32"], ["TENSOR", [42, 1, 7, 7], "float32"], [2, 2], [3, 3], [1, 1], "float32"], {}, ["depthwise_conv2d_nchw", [1, 42, 83, 83, "float32"], [42, 1, 7, 7, "float32"], [2, 2], [3, 3], [1, 1], "float32"], {"i": 1144768, "t": "direct", "c": null, "e": [["tile_f", "sp", [-1, 1, 1, 1]], ["tile_y", "sp", [-1, 1, 3, 2]], ["tile_x", "sp", [-1, 3, 14, 1]], ["auto_unroll_max_step", "ot", 256], ["unroll_explicit", "ot", 1]]}], "r": [[5.8737499999999995e-06], 0, 46.404191732406616, 1601381333.0357401], "v": 0.1}
{"i": ["cuda", "topi_nn_conv2d", [["TENSOR", [1, 42, 42, 42], "float32"], ["TENSOR", [42, 42, 1, 1], "float32"], [1, 1], [0, 0], [1, 1], "NCHW", "float32"], {}, ["conv2d", [1, 42, 42, 42, "float32"], [42, 42, 1, 1, "float32"], [1, 1], [0, 0], [1, 1], "NCHW", "float32"], {"i": 12411417, "t": "direct", "c": null, "e": [["tile_f", "sp", [-1, 2, 21, 1]], ["tile_y", "sp", [-1, 1, 2, 1]], ["tile_x", "sp", [-1, 1, 14, 1]], ["tile_rc", "sp", [-1, 42]], ["tile_ry", "sp", [-1, 1]], ["tile_rx", "sp", [-1, 1]], ["auto_unroll_max_step", "ot", 1500], ["unroll_explicit", "ot", 1]]}], "r": [[4.5318e-06], 0, 63.45539402961731, 1601384226.8821058], "v": 0.1}
{"i": ["cuda", "topi_nn_depthwise_conv2d_nchw", [["TENSOR", [1, 42, 42, 42], "float32"], ["TENSOR", [42, 1, 7, 7], "float32"], [1, 1], [3, 3], [1, 1], "float32"], {}, ["depthwise_conv2d_nchw", [1, 42, 42, 42, "float32"], [42, 1, 7, 7, "float32"], [1, 1], [3, 3], [1, 1], "float32"], {"i": 370752, "t": "direct", "c": null, "e": [["tile_f", "sp", [-1, 1, 1, 1]], ["tile_y", "sp", [-1, 1, 7, 2]], ["tile_x", "sp", [-1, 1, 42, 1]], ["auto_unroll_max_step", "ot", 256], ["unroll_explicit", "ot", 0]]}], "r": [[4.77075e-06], 0, 55.05818796157837, 1601387054.9377158], "v": 0.1}
{"i": ["cuda", "topi_nn_conv2d", [["TENSOR", [1, 42, 42, 42], "float32"], ["TENSOR", [84, 42, 1, 1], "float32"], [1, 1], [0, 0], [1, 1], "NCHW", "float32"], {}, ["conv2d", [1, 42, 42, 42, "float32"], [84, 42, 1, 1, "float32"], [1, 1], [0, 0], [1, 1], "NCHW", "float32"], {"i": 24475083, "t": "direct", "c": null, "e": [["tile_f", "sp", [-1, 2, 14, 1]], ["tile_y", "sp", [-1, 3, 2, 1]], ["tile_x", "sp", [-1, 1, 14, 1]], ["tile_rc", "sp", [-1, 14]], ["tile_ry", "sp", [-1, 1]], ["tile_rx", "sp", [-1, 1]], ["auto_unroll_max_step", "ot", 512], ["unroll_explicit", "ot", 1]]}], "r": [[5.7605e-06], 0, 58.627105712890625, 1601388883.8179228], "v": 0.1}
{"i": ["cuda", "topi_nn_conv2d", [["TENSOR", [1, 168, 83, 83], "float32"], ["TENSOR", [84, 168, 1, 1], "float32"], [1, 1], [0, 0], [1, 1], "NCHW", "float32"], {}, ["conv2d", [1, 168, 83, 83, "float32"], [84, 168, 1, 1, "float32"], [1, 1], [0, 0], [1, 1], "NCHW", "float32"], {"i": 129399, "t": "direct", "c": null, "e": [["tile_f", "sp", [-1, 3, 1, 7]], ["tile_y", "sp", [-1, 1, 1, 1]], ["tile_x", "sp", [-1, 1, 83, 1]], ["tile_rc", "sp", [-1, 3]], ["tile_ry", "sp", [-1, 1]], ["tile_rx", "sp", [-1, 1]], ["auto_unroll_max_step", "ot", 0], ["unroll_explicit", "ot", 1]]}], "r": [[3.812585e-05], 0, 59.298651933670044, 1601390911.4004965], "v": 0.1}
{"i": ["cuda", "topi_nn_conv2d", [["TENSOR", [1, 336, 42, 42], "float32"], ["TENSOR", [168, 336, 1, 1], "float32"], [1, 1], [0, 0], [1, 1], "NCHW", "float32"], {}, ["conv2d", [1, 336, 42, 42, "float32"], [168, 336, 1, 1, "float32"], [1, 1], [0, 0], [1, 1], "NCHW", "float32"], {"i": 92392516, "t": "direct", "c": null, "e": [["tile_f", "sp", [-1, 1, 14, 4]], ["tile_y", "sp", [-1, 1, 14, 1]], ["tile_x", "sp", [-1, 1, 3, 2]], ["tile_rc", "sp", [-1, 21]], ["tile_ry", "sp", [-1, 1]], ["tile_rx", "sp", [-1, 1]], ["auto_unroll_max_step", "ot", 0], ["unroll_explicit", "ot", 1]]}], "r": [[4.3481850000000005e-05], 0, 60.25237512588501, 1601393805.4955568], "v": 0.1}
{"i": ["cuda", "topi_nn_depthwise_conv2d_nchw", [["TENSOR", [1, 42, 83, 83], "float32"], ["TENSOR", [42, 1, 3, 3], "float32"], [1, 1], [1, 1], [1, 1], "float32"], {}, ["depthwise_conv2d_nchw", [1, 42, 83, 83, "float32"], [42, 1, 3, 3, "float32"], [1, 1], [1, 1], [1, 1], "float32"], {"i": 4609, "t": "direct", "c": null, "e": [["tile_f", "sp", [-1, 2, 1, 1]], ["tile_y", "sp", [-1, 1, 1, 1]], ["tile_x", "sp", [-1, 1, 83, 1]], ["auto_unroll_max_step", "ot", 256], ["unroll_explicit", "ot", 1]]}], "r": [[7.398250000000001e-06], 0, 29.978644847869873, 1601394698.0032625], "v": 0.1}
{"i": ["cuda", "topi_nn_depthwise_conv2d_nchw", [["TENSOR", [1, 42, 165, 165], "float32"], ["TENSOR", [42, 1, 5, 5], "float32"], [2, 2], [2, 2], [1, 1], "float32"], {}, ["depthwise_conv2d_nchw", [1, 42, 165, 165, "float32"], [42, 1, 5, 5, "float32"], [2, 2], [2, 2], [1, 1], "float32"], {"i": 4608, "t": "direct", "c": null, "e": [["tile_f", "sp", [-1, 1, 1, 1]], ["tile_y", "sp", [-1, 1, 1, 1]], ["tile_x", "sp", [-1, 1, 83, 1]], ["auto_unroll_max_step", "ot", 256], ["unroll_explicit", "ot", 1]]}], "r": [[1.27794e-05], 0, 28.152035236358643, 1601395529.0237951], "v": 0.1}
{"i": ["cuda", "topi_nn_depthwise_conv2d_nchw", [["TENSOR", [1, 96, 165, 165], "float32"], ["TENSOR", [96, 1, 5, 5], "float32"], [2, 2], [2, 2], [1, 1], "float32"], {}, ["depthwise_conv2d_nchw", [1, 96, 165, 165, "float32"], [96, 1, 5, 5, "float32"], [2, 2], [2, 2], [1, 1], "float32"], {"i": 16128, "t": "direct", "c": null, "e": [["tile_f", "sp", [-1, 1, 1, 1]], ["tile_y", "sp", [-1, 1, 1, 1]], ["tile_x", "sp", [-1, 1, 83, 1]], ["auto_unroll_max_step", "ot", 256], ["unroll_explicit", "ot", 1]]}], "r": [[3.48867e-05], 0, 29.10080575942993, 1601396346.3742502], "v": 0.1}
{"i": ["cuda", "topi_nn_depthwise_conv2d_nchw", [["TENSOR", [1, 42, 83, 83], "float32"], ["TENSOR", [42, 1, 5, 5], "float32"], [1, 1], [2, 2], [1, 1], "float32"], {}, ["depthwise_conv2d_nchw", [1, 42, 83, 83, "float32"], [42, 1, 5, 5, "float32"], [1, 1], [2, 2], [1, 1], "float32"], {"i": 5632, "t": "direct", "c": null, "e": [["tile_f", "sp", [-1, 1, 1, 1]], ["tile_y", "sp", [-1, 1, 1, 1]], ["tile_x", "sp", [-1, 1, 83, 1]], ["auto_unroll_max_step", "ot", 1500], ["unroll_explicit", "ot", 1]]}], "r": [[1.0306000000000001e-05], 0, 16.943822622299194, 1601396783.4100075], "v": 0.1}
{"i": ["cuda", "topi_nn_depthwise_conv2d_nchw", [["TENSOR", [1, 96, 165, 165], "float32"], ["TENSOR", [96, 1, 7, 7], "float32"], [2, 2], [3, 3], [1, 1], "float32"], {}, ["depthwise_conv2d_nchw", [1, 96, 165, 165, "float32"], [96, 1, 7, 7, "float32"], [2, 2], [3, 3], [1, 1], "float32"], {"i": 19713, "t": "direct", "c": null, "e": [["tile_f", "sp", [-1, 2, 1, 1]], ["tile_y", "sp", [-1, 1, 1, 1]], ["tile_x", "sp", [-1, 1, 83, 1]], ["auto_unroll_max_step", "ot", 1500], ["unroll_explicit", "ot", 1]]}], "r": [[4.49037e-05], 0, 22.96054983139038, 1601398372.355142], "v": 0.1}
{"i": ["cuda", "topi_nn_conv2d", [["TENSOR", [1, 96, 83, 83], "float32"], ["TENSOR", [42, 96, 1, 1], "float32"], [1, 1], [0, 0], [1, 1], "NCHW", "float32"], {}, ["conv2d", [1, 96, 83, 83, "float32"], [42, 96, 1, 1, "float32"], [1, 1], [0, 0], [1, 1], "NCHW", "float32"], {"i": 31246, "t": "direct", "c": null, "e": [["tile_f", "sp", [-1, 7, 3, 1]], ["tile_y", "sp", [-1, 1, 1, 1]], ["tile_x", "sp", [-1, 1, 83, 1]], ["tile_rc", "sp", [-1, 12]], ["tile_ry", "sp", [-1, 1]], ["tile_rx", "sp", [-1, 1]], ["auto_unroll_max_step", "ot", 1500], ["unroll_explicit", "ot", 0]]}], "r": [[1.57193e-05], 0, 32.941269874572754, 1601398947.1042585], "v": 0.1}
{"i": ["cuda", "topi_nn_depthwise_conv2d_nchw", [["TENSOR", [1, 42, 83, 83], "float32"], ["TENSOR", [42, 1, 7, 7], "float32"], [1, 1], [3, 3], [1, 1], "float32"], {}, ["depthwise_conv2d_nchw", [1, 42, 83, 83, "float32"], [42, 1, 7, 7, "float32"], [1, 1], [3, 3], [1, 1], "float32"], {"i": 4608, "t": "direct", "c": null, "e": [["tile_f", "sp", [-1, 1, 1, 1]], ["tile_y", "sp", [-1, 1, 1, 1]], ["tile_x", "sp", [-1, 1, 83, 1]], ["auto_unroll_max_step", "ot", 256], ["unroll_explicit", "ot", 1]]}], "r": [[1.492e-05], 0, 29.87265682220459, 1601399738.6946473], "v": 0.1}
{"i": ["cuda", "topi_nn_conv2d", [["TENSOR", [1, 42, 83, 83], "float32"], ["TENSOR", [42, 42, 1, 1], "float32"], [1, 1], [0, 0], [1, 1], "NCHW", "float32"], {}, ["conv2d", [1, 42, 83, 83, "float32"], [42, 42, 1, 1, "float32"], [1, 1], [0, 0], [1, 1], "NCHW", "float32"], {"i": 2617, "t": "direct", "c": null, "e": [["tile_f", "sp", [-1, 1, 1, 14]], ["tile_y", "sp", [-1, 1, 1, 1]], ["tile_x", "sp", [-1, 1, 83, 1]], ["tile_rc", "sp", [-1, 3]], ["tile_ry", "sp", [-1, 1]], ["tile_rx", "sp", [-1, 1]], ["auto_unroll_max_step", "ot", 0], ["unroll_explicit", "ot", 0]]}], "r": [[8.10785e-06], 0, 43.42683410644531, 1601400815.2003334], "v": 0.1}
{"i": ["cuda", "topi_nn_conv2d", [["TENSOR", [1, 3, 331, 331], "float32"], ["TENSOR", [96, 3, 3, 3], "float32"], [2, 2], [0, 0], [1, 1], "NCHW", "float32"], {}, ["conv2d", [1, 3, 331, 331, "float32"], [96, 3, 3, 3, "float32"], [2, 2], [0, 0], [1, 1], "NCHW", "float32"], {"i": 13203480, "t": "direct", "c": null, "e": [["tile_f", "sp", [-1, 4, 3, 1]], ["tile_y", "sp", [-1, 1, 1, 1]], ["tile_x", "sp", [-1, 3, 55, 1]], ["tile_rc", "sp", [-1, 1]], ["tile_ry", "sp", [-1, 3]], ["tile_rx", "sp", [-1, 3]], ["auto_unroll_max_step", "ot", 512], ["unroll_explicit", "ot", 0]]}], "r": [[2.9978349999999997e-05], 0, 13.41724944114685, 1601402314.2471762], "v": 0.1}
{"i": ["cuda", "topi_nn_conv2d", [["TENSOR", [1, 96, 165, 165], "float32"], ["TENSOR", [42, 96, 1, 1], "float32"], [1, 1], [0, 0], [1, 1], "NCHW", "float32"], {}, ["conv2d", [1, 96, 165, 165, "float32"], [42, 96, 1, 1, "float32"], [1, 1], [0, 0], [1, 1], "NCHW", "float32"], {"i": 4016428, "t": "direct", "c": null, "e": [["tile_f", "sp", [-1, 1, 14, 3]], ["tile_y", "sp", [-1, 1, 1, 5]], ["tile_x", "sp", [-1, 1, 15, 1]], ["tile_rc", "sp", [-1, 4]], ["tile_ry", "sp", [-1, 1]], ["tile_rx", "sp", [-1, 1]], ["auto_unroll_max_step", "ot", 512], ["unroll_explicit", "ot", 0]]}], "r": [[4.363075e-05], 0, 34.815388202667236, 1601404341.3995593], "v": 0.1}
{"i": ["cuda", "topi_nn_conv2d", [["TENSOR", [1, 168, 83, 83], "float32"], ["TENSOR", [84, 168, 1, 1], "float32"], [2, 2], [0, 0], [1, 1], "NCHW", "float32"], {}, ["conv2d", [1, 168, 83, 83, "float32"], [84, 168, 1, 1, "float32"], [2, 2], [0, 0], [1, 1], "NCHW", "float32"], {"i": 27754770, "t": "direct", "c": null, "e": [["tile_f", "sp", [-1, 3, 28, 1]], ["tile_y", "sp", [-1, 1, 1, 2]], ["tile_x", "sp", [-1, 1, 14, 1]], ["tile_rc", "sp", [-1, 24]], ["tile_ry", "sp", [-1, 1]], ["tile_rx", "sp", [-1, 1]], ["auto_unroll_max_step", "ot", 1500], ["unroll_explicit", "ot", 0]]}], "r": [[1.62277e-05], 0, 38.240612506866455, 1601405450.7200801], "v": 0.1}
{"i": ["cuda", "topi_nn_conv2d", [["TENSOR", [1, 1008, 42, 42], "float32"], ["TENSOR", [168, 1008, 1, 1], "float32"], [1, 1], [0, 0], [1, 1], "NCHW", "float32"], {}, ["conv2d", [1, 1008, 42, 42, "float32"], [168, 1008, 1, 1, "float32"], [1, 1], [0, 0], [1, 1], "NCHW", "float32"], {"i": 207918153, "t": "direct", "c": null, "e": [["tile_f", "sp", [-1, 2, 21, 1]], ["tile_y", "sp", [-1, 1, 6, 1]], ["tile_x", "sp", [-1, 1, 2, 3]], ["tile_rc", "sp", [-1, 12]], ["tile_ry", "sp", [-1, 1]], ["tile_rx", "sp", [-1, 1]], ["auto_unroll_max_step", "ot", 1500], ["unroll_explicit", "ot", 1]]}], "r": [[0.0001219965], 0, 31.649476051330566, 1601406981.2957516], "v": 0.1}
{"i": ["cuda", "topi_nn_conv2d", [["TENSOR", [1, 840, 42, 42], "float32"], ["TENSOR", [168, 840, 1, 1], "float32"], [1, 1], [0, 0], [1, 1], "NCHW", "float32"], {}, ["conv2d", [1, 840, 42, 42, "float32"], [168, 840, 1, 1, "float32"], [1, 1], [0, 0], [1, 1], "NCHW", "float32"], {"i": 96138919, "t": "direct", "c": null, "e": [["tile_f", "sp", [-1, 6, 4, 1]], ["tile_y", "sp", [-1, 1, 7, 1]], ["tile_x", "sp", [-1, 1, 14, 1]], ["tile_rc", "sp", [-1, 12]], ["tile_ry", "sp", [-1, 1]], ["tile_rx", "sp", [-1, 1]], ["auto_unroll_max_step", "ot", 1500], ["unroll_explicit", "ot", 0]]}], "r": [[0.00010340124999999999], 0, 22.382892370224, 1601407926.5002987], "v": 0.1}
{"i": ["cuda", "topi_nn_depthwise_conv2d_nchw", [["TENSOR", [1, 168, 42, 42], "float32"], ["TENSOR", [168, 1, 5, 5], "float32"], [1, 1], [2, 2], [1, 1], "float32"], {}, ["depthwise_conv2d_nchw", [1, 168, 42, 42, "float32"], [168, 1, 5, 5, "float32"], [1, 1], [2, 2], [1, 1], "float32"], {"i": 545920, "t": "direct", "c": null, "e": [["tile_f", "sp", [-1, 1, 1, 1]], ["tile_y", "sp", [-1, 1, 7, 3]], ["tile_x", "sp", [-1, 1, 42, 1]], ["auto_unroll_max_step", "ot", 0], ["unroll_explicit", "ot", 0]]}], "r": [[5.6984500000000005e-06], 0, 31.252554655075073, 1601409429.8274186], "v": 0.1}
{"i": ["cuda", "topi_nn_conv2d", [["TENSOR", [1, 168, 42, 42], "float32"], ["TENSOR", [168, 168, 1, 1], "float32"], [1, 1], [0, 0], [1, 1], "NCHW", "float32"], {}, ["conv2d", [1, 168, 42, 42, "float32"], [168, 168, 1, 1, "float32"], [1, 1], [0, 0], [1, 1], "NCHW", "float32"], {"i": 48956032, "t": "direct", "c": null, "e": [["tile_f", "sp", [-1, 1, 7, 4]], ["tile_y", "sp", [-1, 1, 1, 2]], ["tile_x", "sp", [-1, 1, 14, 1]], ["tile_rc", "sp", [-1, 7]], ["tile_ry", "sp", [-1, 1]], ["tile_rx", "sp", [-1, 1]], ["auto_unroll_max_step", "ot", 1500], ["unroll_explicit", "ot", 0]]}], "r": [[2.186395e-05], 0, 32.3464879989624, 1601410803.705612], "v": 0.1}
{"i": ["cuda", "topi_nn_conv2d", [["TENSOR", [1, 840, 42, 42], "float32"], ["TENSOR", [168, 840, 1, 1], "float32"], [2, 2], [0, 0], [1, 1], "NCHW", "float32"], {}, ["conv2d", [1, 840, 42, 42, "float32"], [168, 840, 1, 1, "float32"], [2, 2], [0, 0], [1, 1], "NCHW", "float32"], {"i": 1269819, "t": "direct", "c": null, "e": [["tile_f", "sp", [-1, 3, 8, 1]], ["tile_y", "sp", [-1, 1, 1, 1]], ["tile_x", "sp", [-1, 1, 21, 1]], ["tile_rc", "sp", [-1, 28]], ["tile_ry", "sp", [-1, 1]], ["tile_rx", "sp", [-1, 1]], ["auto_unroll_max_step", "ot", 0], ["unroll_explicit", "ot", 0]]}], "r": [[5.29603e-05], 0, 39.401512145996094, 1601412206.1177182], "v": 0.1}
{"i": ["cuda", "topi_nn_conv2d", [["TENSOR", [1, 2016, 21, 21], "float32"], ["TENSOR", [336, 2016, 1, 1], "float32"], [1, 1], [0, 0], [1, 1], "NCHW", "float32"], {}, ["conv2d", [1, 2016, 21, 21, "float32"], [336, 2016, 1, 1, "float32"], [1, 1], [0, 0], [1, 1], "NCHW", "float32"], {"i": 22142593, "t": "direct", "c": null, "e": [["tile_f", "sp", [-1, 1, 8, 2]], ["tile_y", "sp", [-1, 1, 3, 1]], ["tile_x", "sp", [-1, 3, 7, 1]], ["tile_rc", "sp", [-1, 16]], ["tile_ry", "sp", [-1, 1]], ["tile_rx", "sp", [-1, 1]], ["auto_unroll_max_step", "ot", 512], ["unroll_explicit", "ot", 1]]}], "r": [[0.0001565097], 0, 31.68021559715271, 1601414261.3238106], "v": 0.1}
{"i": ["cuda", "topi_nn_conv2d", [["TENSOR", [1, 1680, 21, 21], "float32"], ["TENSOR", [336, 1680, 1, 1], "float32"], [1, 1], [0, 0], [1, 1], "NCHW", "float32"], {}, ["conv2d", [1, 1680, 21, 21, "float32"], [336, 1680, 1, 1, "float32"], [1, 1], [0, 0], [1, 1], "NCHW", "float32"], {"i": 26450738, "t": "direct", "c": null, "e": [["tile_f", "sp", [-1, 1, 14, 3]], ["tile_y", "sp", [-1, 3, 1, 1]], ["tile_x", "sp", [-1, 1, 21, 1]], ["tile_rc", "sp", [-1, 70]], ["tile_ry", "sp", [-1, 1]], ["tile_rx", "sp", [-1, 1]], ["auto_unroll_max_step", "ot", 512], ["unroll_explicit", "ot", 1]]}], "r": [[0.000118635], 0, 31.727346658706665, 1601416033.070602], "v": 0.1}
{"i": ["cuda", "topi_nn_depthwise_conv2d_nchw", [["TENSOR", [1, 336, 21, 21], "float32"], ["TENSOR", [336, 1, 5, 5], "float32"], [1, 1], [2, 2], [1, 1], "float32"], {}, ["depthwise_conv2d_nchw", [1, 336, 21, 21, "float32"], [336, 1, 5, 5, "float32"], [1, 1], [2, 2], [1, 1], "float32"], {"i": 630745, "t": "direct", "c": null, "e": [["tile_f", "sp", [-1, 1, 7, 2]], ["tile_y", "sp", [-1, 1, 7, 1]], ["tile_x", "sp", [-1, 1, 7, 1]], ["auto_unroll_max_step", "ot", 256], ["unroll_explicit", "ot", 1]]}], "r": [[7.52855e-06], 0, 29.814008951187134, 1601416614.1413827], "v": 0.1}
{"i": ["cuda", "topi_nn_conv2d", [["TENSOR", [1, 336, 21, 21], "float32"], ["TENSOR", [336, 336, 1, 1], "float32"], [1, 1], [0, 0], [1, 1], "NCHW", "float32"], {}, ["conv2d", [1, 336, 21, 21, "float32"], [336, 336, 1, 1, "float32"], [1, 1], [0, 0], [1, 1], "NCHW", "float32"], {"i": 3799764, "t": "direct", "c": null, "e": [["tile_f", "sp", [-1, 2, 3, 2]], ["tile_y", "sp", [-1, 3, 1, 1]], ["tile_x", "sp", [-1, 1, 21, 1]], ["tile_rc", "sp", [-1, 8]], ["tile_ry", "sp", [-1, 1]], ["tile_rx", "sp", [-1, 1]], ["auto_unroll_max_step", "ot", 512], ["unroll_explicit", "ot", 0]]}], "r": [[2.92265e-05], 0, 42.58167290687561, 1601418463.4361048], "v": 0.1}
{"i": ["cuda", "topi_nn_conv2d", [["TENSOR", [1, 1680, 21, 21], "float32"], ["TENSOR", [336, 1680, 1, 1], "float32"], [2, 2], [0, 0], [1, 1], "NCHW", "float32"], {}, ["conv2d", [1, 1680, 21, 21, "float32"], [336, 1680, 1, 1, "float32"], [2, 2], [0, 0], [1, 1], "NCHW", "float32"], {"i": 479438, "t": "direct", "c": null, "e": [["tile_f", "sp", [-1, 3, 8, 1]], ["tile_y", "sp", [-1, 1, 1, 1]], ["tile_x", "sp", [-1, 1, 11, 1]], ["tile_rc", "sp", [-1, 20]], ["tile_ry", "sp", [-1, 1]], ["tile_rx", "sp", [-1, 1]], ["auto_unroll_max_step", "ot", 512], ["unroll_explicit", "ot", 0]]}], "r": [[6.925465e-05], 0, 27.16844391822815, 1601419334.6847801], "v": 0.1}
{"i": ["cuda", "topi_nn_conv2d", [["TENSOR", [1, 4032, 11, 11], "float32"], ["TENSOR", [672, 4032, 1, 1], "float32"], [1, 1], [0, 0], [1, 1], "NCHW", "float32"], {}, ["conv2d", [1, 4032, 11, 11, "float32"], [672, 4032, 1, 1, "float32"], [1, 1], [0, 0], [1, 1], "NCHW", "float32"], {"i": 3204222, "t": "direct", "c": null, "e": [["tile_f", "sp", [-1, 3, 16, 1]], ["tile_y", "sp", [-1, 1, 1, 1]], ["tile_x", "sp", [-1, 1, 11, 1]], ["tile_rc", "sp", [-1, 24]], ["tile_ry", "sp", [-1, 1]], ["tile_rx", "sp", [-1, 1]], ["auto_unroll_max_step", "ot", 1500], ["unroll_explicit", "ot", 1]]}], "r": [[0.0002517957], 0, 7.198675870895386, 1601420817.1004186], "v": 0.1}
{"i": ["cuda", "topi_nn_conv2d", [["TENSOR", [1, 3360, 11, 11], "float32"], ["TENSOR", [672, 3360, 1, 1], "float32"], [1, 1], [0, 0], [1, 1], "NCHW", "float32"], {}, ["conv2d", [1, 3360, 11, 11, "float32"], [672, 3360, 1, 1, "float32"], [1, 1], [0, 0], [1, 1], "NCHW", "float32"], {"i": 2286879, "t": "direct", "c": null, "e": [["tile_f", "sp", [-1, 1, 16, 2]], ["tile_y", "sp", [-1, 1, 1, 1]], ["tile_x", "sp", [-1, 1, 11, 1]], ["tile_rc", "sp", [-1, 24]], ["tile_ry", "sp", [-1, 1]], ["tile_rx", "sp", [-1, 1]], ["auto_unroll_max_step", "ot", 0], ["unroll_explicit", "ot", 1]]}], "r": [[0.00021325910000000002], 0, 21.799554586410522, 1601421499.9226599], "v": 0.1}
{"i": ["cuda", "topi_nn_depthwise_conv2d_nchw", [["TENSOR", [1, 672, 11, 11], "float32"], ["TENSOR", [672, 1, 5, 5], "float32"], [1, 1], [2, 2], [1, 1], "float32"], {}, ["depthwise_conv2d_nchw", [1, 672, 11, 11, "float32"], [672, 1, 5, 5, "float32"], [1, 1], [2, 2], [1, 1], "float32"], {"i": 8960, "t": "direct", "c": null, "e": [["tile_f", "sp", [-1, 1, 1, 1]], ["tile_y", "sp", [-1, 1, 11, 1]], ["tile_x", "sp", [-1, 1, 11, 1]], ["auto_unroll_max_step", "ot", 0], ["unroll_explicit", "ot", 0]]}], "r": [[4.63025e-06], 0, 10.751084566116333, 1601422394.142861], "v": 0.1}
{"i": ["cuda", "topi_nn_conv2d", [["TENSOR", [1, 672, 11, 11], "float32"], ["TENSOR", [672, 672, 1, 1], "float32"], [1, 1], [0, 0], [1, 1], "NCHW", "float32"], {}, ["conv2d", [1, 672, 11, 11, "float32"], [672, 672, 1, 1, "float32"], [1, 1], [0, 0], [1, 1], "NCHW", "float32"], {"i": 525114, "t": "direct", "c": null, "e": [["tile_f", "sp", [-1, 3, 4, 1]], ["tile_y", "sp", [-1, 1, 11, 1]], ["tile_x", "sp", [-1, 1, 11, 1]], ["tile_rc", "sp", [-1, 28]], ["tile_ry", "sp", [-1, 1]], ["tile_rx", "sp", [-1, 1]], ["auto_unroll_max_step", "ot", 512], ["unroll_explicit", "ot", 0]]}], "r": [[4.058675e-05], 0, 10.693600177764893, 1601423473.2481365], "v": 0.1}
