experiments/latency/tvm_schedule_configs/randwire_large_None_1.log
{"i": ["cuda", "topi_nn_conv2d", [["TENSOR", [1, 3, 224, 224], "float32"], ["TENSOR", [77, 3, 3, 3], "float32"], [2, 2], [1, 1], [1, 1], "NCHW", "float32"], {}, ["conv2d", [1, 3, 224, 224, "float32"], [77, 3, 3, 3, "float32"], [2, 2], [1, 1], [1, 1], "NCHW", "float32"], {"i": 11999707, "t": "direct", "c": null, "e": [["tile_f", "sp", [-1, 1, 11, 7]], ["tile_y", "sp", [-1, 2, 1, 1]], ["tile_x", "sp", [-1, 1, 16, 1]], ["tile_rc", "sp", [-1, 1]], ["tile_ry", "sp", [-1, 3]], ["tile_rx", "sp", [-1, 3]], ["auto_unroll_max_step", "ot", 512], ["unroll_explicit", "ot", 1]]}], "r": [[1.094495e-05], 0, 87.85280728340149, 1601332001.3261058], "v": 0.1}
{"i": ["cuda", "topi_nn_depthwise_conv2d_nchw", [["TENSOR", [1, 77, 112, 112], "float32"], ["TENSOR", [77, 1, 3, 3], "float32"], [2, 2], [1, 1], [1, 1], "float32"], {}, ["depthwise_conv2d_nchw", [1, 77, 112, 112, "float32"], [77, 1, 3, 3, "float32"], [2, 2], [1, 1], [1, 1], "float32"], {"i": 446016, "t": "direct", "c": null, "e": [["tile_f", "sp", [-1, 1, 1, 1]], ["tile_y", "sp", [-1, 1, 2, 2]], ["tile_x", "sp", [-1, 2, 28, 1]], ["auto_unroll_max_step", "ot", 256], ["unroll_explicit", "ot", 1]]}], "r": [[5.64495e-06], 0, 58.21667003631592, 1601334608.811606], "v": 0.1}
{"i": ["cuda", "topi_nn_conv2d", [["TENSOR", [1, 77, 56, 56], "float32"], ["TENSOR", [154, 77, 1, 1], "float32"], [1, 1], [0, 0], [1, 1], "NCHW", "float32"], {}, ["conv2d", [1, 77, 56, 56, "float32"], [154, 77, 1, 1, "float32"], [1, 1], [0, 0], [1, 1], "NCHW", "float32"], {"i": 9149537, "t": "direct", "c": null, "e": [["tile_f", "sp", [-1, 1, 11, 2]], ["tile_y", "sp", [-1, 2, 1, 1]], ["tile_x", "sp", [-1, 1, 28, 1]], ["tile_rc", "sp", [-1, 11]], ["tile_ry", "sp", [-1, 1]], ["tile_rx", "sp", [-1, 1]], ["auto_unroll_max_step", "ot", 1500], ["unroll_explicit", "ot", 1]]}], "r": [[1.579055e-05], 0, 68.81862378120422, 1601337924.5796857], "v": 0.1}
{"i": ["cuda", "topi_nn_depthwise_conv2d_nchw", [["TENSOR", [1, 154, 56, 56], "float32"], ["TENSOR", [154, 1, 3, 3], "float32"], [1, 1], [1, 1], [1, 1], "float32"], {}, ["depthwise_conv2d_nchw", [1, 154, 56, 56, "float32"], [154, 1, 3, 3, "float32"], [1, 1], [1, 1], [1, 1], "float32"], {"i": 2199195, "t": "direct", "c": null, "e": [["tile_f", "sp", [-1, 1, 1, 2]], ["tile_y", "sp", [-1, 1, 7, 2]], ["tile_x", "sp", [-1, 1, 56, 1]], ["auto_unroll_max_step", "ot", 1500], ["unroll_explicit", "ot", 1]]}], "r": [[6.19645e-06], 0, 81.67147660255432, 1601341499.759198], "v": 0.1}
{"i": ["cuda", "topi_nn_conv2d", [["TENSOR", [1, 154, 56, 56], "float32"], ["TENSOR", [154, 154, 1, 1], "float32"], [1, 1], [0, 0], [1, 1], "NCHW", "float32"], {}, ["conv2d", [1, 154, 56, 56, "float32"], [154, 154, 1, 1, "float32"], [1, 1], [0, 0], [1, 1], "NCHW", "float32"], {"i": 8725098, "t": "direct", "c": null, "e": [["tile_f", "sp", [-1, 1, 11, 7]], ["tile_y", "sp", [-1, 2, 2, 1]], ["tile_x", "sp", [-1, 1, 14, 1]], ["tile_rc", "sp", [-1, 22]], ["tile_ry", "sp", [-1, 1]], ["tile_rx", "sp", [-1, 1]], ["auto_unroll_max_step", "ot", 1500], ["unroll_explicit", "ot", 0]]}], "r": [[2.940285e-05], 0, 93.80068373680115, 1601343642.6457841], "v": 0.1}
{"i": ["cuda", "topi_nn_depthwise_conv2d_nchw", [["TENSOR", [1, 154, 56, 56], "float32"], ["TENSOR", [154, 1, 3, 3], "float32"], [2, 2], [1, 1], [1, 1], "float32"], {}, ["depthwise_conv2d_nchw", [1, 154, 56, 56, "float32"], [154, 1, 3, 3, "float32"], [2, 2], [1, 1], [1, 1], "float32"], {"i": 555585, "t": "direct", "c": null, "e": [["tile_f", "sp", [-1, 2, 1, 1]], ["tile_y", "sp", [-1, 2, 1, 1]], ["tile_x", "sp", [-1, 1, 28, 1]], ["auto_unroll_max_step", "ot", 1500], ["unroll_explicit", "ot", 1]]}], "r": [[5.12345e-06], 0, 94.08415484428406, 1601345776.1322908], "v": 0.1}
{"i": ["cuda", "topi_nn_conv2d", [["TENSOR", [1, 154, 28, 28], "float32"], ["TENSOR", [308, 154, 1, 1], "float32"], [1, 1], [0, 0], [1, 1], "NCHW", "float32"], {}, ["conv2d", [1, 154, 28, 28, "float32"], [308, 154, 1, 1, "float32"], [1, 1], [0, 0], [1, 1], "NCHW", "float32"], {"i": 4717045, "t": "direct", "c": null, "e": [["tile_f", "sp", [-1, 1, 7, 4]], ["tile_y", "sp", [-1, 2, 1, 1]], ["tile_x", "sp", [-1, 1, 28, 1]], ["tile_rc", "sp", [-1, 7]], ["tile_ry", "sp", [-1, 1]], ["tile_rx", "sp", [-1, 1]], ["auto_unroll_max_step", "ot", 1500], ["unroll_explicit", "ot", 0]]}], "r": [[1.256935e-05], 0, 84.88931512832642, 1601348843.7436423], "v": 0.1}
{"i": ["cuda", "topi_nn_depthwise_conv2d_nchw", [["TENSOR", [1, 308, 28, 28], "float32"], ["TENSOR", [308, 1, 3, 3], "float32"], [1, 1], [1, 1], [1, 1], "float32"], {}, ["depthwise_conv2d_nchw", [1, 308, 28, 28, "float32"], [308, 1, 3, 3, "float32"], [1, 1], [1, 1], [1, 1], "float32"], {"i": 1136652, "t": "direct", "c": null, "e": [["tile_f", "sp", [-1, 1, 2, 1]], ["tile_y", "sp", [-1, 1, 7, 2]], ["tile_x", "sp", [-1, 1, 28, 1]], ["auto_unroll_max_step", "ot", 256], ["unroll_explicit", "ot", 1]]}], "r": [[4.5901e-06], 0, 85.58489322662354, 1601352256.411647], "v": 0.1}
{"i": ["cuda", "topi_nn_conv2d", [["TENSOR", [1, 308, 28, 28], "float32"], ["TENSOR", [308, 308, 1, 1], "float32"], [1, 1], [0, 0], [1, 1], "NCHW", "float32"], {}, ["conv2d", [1, 308, 28, 28, "float32"], [308, 308, 1, 1, "float32"], [1, 1], [0, 0], [1, 1], "NCHW", "float32"], {"i": 7081354, "t": "direct", "c": null, "e": [["tile_f", "sp", [-1, 1, 14, 2]], ["tile_y", "sp", [-1, 1, 1, 2]], ["tile_x", "sp", [-1, 1, 14, 2]], ["tile_rc", "sp", [-1, 7]], ["tile_ry", "sp", [-1, 1]], ["tile_rx", "sp", [-1, 1]], ["auto_unroll_max_step", "ot", 1500], ["unroll_explicit", "ot", 0]]}], "r": [[2.829335e-05], 0, 102.75924897193909, 1601356200.3389094], "v": 0.1}
{"i": ["cuda", "topi_nn_depthwise_conv2d_nchw", [["TENSOR", [1, 308, 28, 28], "float32"], ["TENSOR", [308, 1, 3, 3], "float32"], [2, 2], [1, 1], [1, 1], "float32"], {}, ["depthwise_conv2d_nchw", [1, 308, 28, 28, "float32"], [308, 1, 3, 3, "float32"], [2, 2], [1, 1], [1, 1], "float32"], {"i": 185280, "t": "direct", "c": null, "e": [["tile_f", "sp", [-1, 1, 1, 1]], ["tile_y", "sp", [-1, 1, 7, 1]], ["tile_x", "sp", [-1, 1, 14, 1]], ["auto_unroll_max_step", "ot", 256], ["unroll_explicit", "ot", 1]]}], "r": [[4.3478e-06], 0, 82.38248085975647, 1601359000.467668], "v": 0.1}
{"i": ["cuda", "topi_nn_conv2d", [["TENSOR", [1, 308, 14, 14], "float32"], ["TENSOR", [616, 308, 1, 1], "float32"], [1, 1], [0, 0], [1, 1], "NCHW", "float32"], {}, ["conv2d", [1, 308, 14, 14, "float32"], [616, 308, 1, 1, "float32"], [1, 1], [0, 0], [1, 1], "NCHW", "float32"], {"i": 2418084, "t": "direct", "c": null, "e": [["tile_f", "sp", [-1, 1, 14, 4]], ["tile_y", "sp", [-1, 1, 2, 1]], ["tile_x", "sp", [-1, 1, 14, 1]], ["tile_rc", "sp", [-1, 14]], ["tile_ry", "sp", [-1, 1]], ["tile_rx", "sp", [-1, 1]], ["auto_unroll_max_step", "ot", 1500], ["unroll_explicit", "ot", 0]]}], "r": [[1.536175e-05], 0, 68.20105576515198, 1601362178.7684982], "v": 0.1}
{"i": ["cuda", "topi_nn_depthwise_conv2d_nchw", [["TENSOR", [1, 616, 14, 14], "float32"], ["TENSOR", [616, 1, 3, 3], "float32"], [1, 1], [1, 1], [1, 1], "float32"], {}, ["depthwise_conv2d_nchw", [1, 616, 14, 14, "float32"], [616, 1, 3, 3, "float32"], [1, 1], [1, 1], [1, 1], "float32"], {"i": 468496, "t": "direct", "c": null, "e": [["tile_f", "sp", [-1, 1, 2, 1]], ["tile_y", "sp", [-1, 1, 14, 1]], ["tile_x", "sp", [-1, 1, 7, 2]], ["auto_unroll_max_step", "ot", 1500], ["unroll_explicit", "ot", 1]]}], "r": [[3.8762e-06], 0, 85.52105808258057, 1601365677.0157206], "v": 0.1}
{"i": ["cuda", "topi_nn_conv2d", [["TENSOR", [1, 616, 14, 14], "float32"], ["TENSOR", [616, 616, 1, 1], "float32"], [1, 1], [0, 0], [1, 1], "NCHW", "float32"], {}, ["conv2d", [1, 616, 14, 14, "float32"], [616, 616, 1, 1, "float32"], [1, 1], [0, 0], [1, 1], "NCHW", "float32"], {"i": 7251269, "t": "direct", "c": null, "e": [["tile_f", "sp", [-1, 2, 28, 1]], ["tile_y", "sp", [-1, 1, 2, 1]], ["tile_x", "sp", [-1, 1, 14, 1]], ["tile_rc", "sp", [-1, 28]], ["tile_ry", "sp", [-1, 1]], ["tile_rx", "sp", [-1, 1]], ["auto_unroll_max_step", "ot", 1500], ["unroll_explicit", "ot", 1]]}], "r": [[3.0539450000000005e-05], 0, 97.04552102088928, 1601369071.91117], "v": 0.1}
{"i": ["cuda", "topi_nn_depthwise_conv2d_nchw", [["TENSOR", [1, 616, 14, 14], "float32"], ["TENSOR", [616, 1, 3, 3], "float32"], [2, 2], [1, 1], [1, 1], "float32"], {}, ["depthwise_conv2d_nchw", [1, 616, 14, 14, "float32"], [616, 1, 3, 3, "float32"], [2, 2], [1, 1], [1, 1], "float32"], {"i": 23108, "t": "direct", "c": null, "e": [["tile_f", "sp", [-1, 1, 28, 1]], ["tile_y", "sp", [-1, 1, 1, 1]], ["tile_x", "sp", [-1, 1, 7, 1]], ["auto_unroll_max_step", "ot", 256], ["unroll_explicit", "ot", 1]]}], "r": [[4.69545e-06], 0, 97.21278524398804, 1601369935.4797144], "v": 0.1}
{"i": ["cuda", "topi_nn_conv2d", [["TENSOR", [1, 616, 7, 7], "float32"], ["TENSOR", [1232, 616, 1, 1], "float32"], [1, 1], [0, 0], [1, 1], "NCHW", "float32"], {}, ["conv2d", [1, 616, 7, 7, "float32"], [1232, 616, 1, 1, "float32"], [1, 1], [0, 0], [1, 1], "NCHW", "float32"], {"i": 238724, "t": "direct", "c": null, "e": [["tile_f", "sp", [-1, 2, 4, 2]], ["tile_y", "sp", [-1, 1, 7, 1]], ["tile_x", "sp", [-1, 1, 7, 1]], ["tile_rc", "sp", [-1, 56]], ["tile_ry", "sp", [-1, 1]], ["tile_rx", "sp", [-1, 1]], ["auto_unroll_max_step", "ot", 512], ["unroll_explicit", "ot", 0]]}], "r": [[2.5292400000000002e-05], 0, 81.81691598892212, 1601373803.72786], "v": 0.1}
{"i": ["cuda", "topi_nn_depthwise_conv2d_nchw", [["TENSOR", [1, 1232, 7, 7], "float32"], ["TENSOR", [1232, 1, 3, 3], "float32"], [1, 1], [1, 1], [1, 1], "float32"], {}, ["depthwise_conv2d_nchw", [1, 1232, 7, 7, "float32"], [1232, 1, 3, 3, "float32"], [1, 1], [1, 1], [1, 1], "float32"], {"i": 32516, "t": "direct", "c": null, "e": [["tile_f", "sp", [-1, 1, 4, 1]], ["tile_y", "sp", [-1, 1, 7, 1]], ["tile_x", "sp", [-1, 1, 7, 1]], ["auto_unroll_max_step", "ot", 0], ["unroll_explicit", "ot", 1]]}], "r": [[3.49e-06], 0, 88.36977505683899, 1601375552.9795117], "v": 0.1}
{"i": ["cuda", "topi_nn_conv2d", [["TENSOR", [1, 1232, 7, 7], "float32"], ["TENSOR", [1232, 1232, 1, 1], "float32"], [1, 1], [0, 0], [1, 1], "NCHW", "float32"], {}, ["conv2d", [1, 1232, 7, 7, "float32"], [1232, 1232, 1, 1, "float32"], [1, 1], [0, 0], [1, 1], "NCHW", "float32"], {"i": 140191, "t": "direct", "c": null, "e": [["tile_f", "sp", [-1, 1, 14, 2]], ["tile_y", "sp", [-1, 1, 7, 1]], ["tile_x", "sp", [-1, 1, 7, 1]], ["tile_rc", "sp", [-1, 154]], ["tile_ry", "sp", [-1, 1]], ["tile_rx", "sp", [-1, 1]], ["auto_unroll_max_step", "ot", 0], ["unroll_explicit", "ot", 0]]}], "r": [[7.204855000000001e-05], 0, 79.48981666564941, 1601378062.5370796], "v": 0.1}
{"i": ["cuda", "topi_nn_conv2d", [["TENSOR", [1, 1232, 7, 7], "float32"], ["TENSOR", [1280, 1232, 1, 1], "float32"], [1, 1], [0, 0], [1, 1], "NCHW", "float32"], {}, ["conv2d", [1, 1232, 7, 7, "float32"], [1280, 1232, 1, 1, "float32"], [1, 1], [0, 0], [1, 1], "NCHW", "float32"], {"i": 524205, "t": "direct", "c": null, "e": [["tile_f", "sp", [-1, 1, 4, 2]], ["tile_y", "sp", [-1, 1, 7, 1]], ["tile_x", "sp", [-1, 1, 7, 1]], ["tile_rc", "sp", [-1, 28]], ["tile_ry", "sp", [-1, 1]], ["tile_rx", "sp", [-1, 1]], ["auto_unroll_max_step", "ot", 1500], ["unroll_explicit", "ot", 0]]}], "r": [[5.797975e-05], 0, 57.10692095756531, 1601380224.5414333], "v": 0.1}
